Nº RGSEAA (*),Razón Social,Provincia/Localidad,Actividades,Especies (**),Otros Detalles,TSE Feed Ban
40.22738/SG,DISTRIBUCIONES ALIMENTARIAS SEGOVIANAS S.L.,Segovia/HONTORIA,CS,,,
40.22739/VA,"ACEITUNAS OLIBHER, S.L.",Valladolid/FUENSALDAÑA,CS,,,
10.20287/SG,JAMONES PASCUAL AREVALO S.L.,Segovia/CARBONERO EL MAYOR,PP,,MP,
15.05944/SA,FLORENCIO GOMEZ MUÑOZ,Salamanca/CIUDAD RODRIGO,CS,,,
10.20347/VA,"MARTIN & GEIJO, S. L.",Valladolid/VALLADOLID,"CS, CP, MM, MP",,,
12.16490/SA,"M. COLINAS PESCADOS, S. L.",Salamanca/SALAMANCA,CS,,,
10.20477/SA,"MIGUEL MARTIN GOMEZ, S. L.",Salamanca/GUIJUELO,PP,,MP,
10.20480/P,AVICULTURA CAMPESINA PALENTINA C.B.,Palencia/AMAYUELAS DE ABAJO,"SH, CP",A,,
10.20502/SA,"SELECTOS EL MONTE, S.L.",Salamanca/GUIJUELO,PP,,MP,
10.20507/SA,"CESAR NIETO, S. L.",Salamanca/GUIJUELO,PP,,MP,
10.20509/SG,"FRUCTUOSO AREVALO HERRERO, S. L.",Segovia/CANTIMPALOS,"RW, PP",,MP,
10.20548/SA,"EMBUTIDOS LEONCIO, S. L.",Salamanca/GUIJUELO,"CS, PP",,MP,
40.23242/ZA,"COMERCIAL SAN FRONTIS, S. L.",Zamora/ZAMORA,CS,,,
10.20581/SA,"HELMANTICA TERRA, S.L.",Salamanca/GUIJUELO,RW,,MP,
10.20594/SO,CARNICERIA MARTINEZ S.C.,Soria/ALMARZA,"MM, MP, PP",,MP,
10.20607/SG,"YAH JAMONES, S. L.",Segovia/ENCINILLAS,PP,,MP,
10.20611/BU,"CARNICAS TAJADURA PROGRESO, S.L.",Burgos/BURGOS,CS,,,
40.23389/LE,"CODALVA, S. L.",León/CAMPONARAYA,"CS, RW",,,
10.20658/BU,"CARNICAS ISABEL ALONSO, S.L.",Burgos/BURGOS,"CS, CP, MM, MP",,,
10.20660/ZA,MARIA MAGDALENA MANZANAS GONZALEZ,Zamora/GRISUELA,CS,,,
10.20734/SA,"CATEDRA SALMANTINA, S. L. U.",Salamanca/LEDRADA,PP,,MP,
40.23586/BU,"PROAVEN MUÑOZ, S. L.",Burgos/ARANDA DE DUERO,CS,,,
40.23641/LE,"HEREDEROS DE ELICERIO Y JESUSA, S. L.",León/SAN ANDRES DEL RABANEDO,CS,,,
40.23703/AV,"AVILA CALIDAD , S. L.",Ávila/AVILA,CS,,,
40.23735/VA,SAUL FURONES S.L.,Valladolid/SANTOVENIA DE PISUERGA,CS,,,
40.23736/SA,"MARCOS SOTOSERRANO, S. L.",Salamanca/SOTOSERRANO,CS,,,
40.23785/BU,"SUPERMERCADOS SABECO, S.A.",Burgos/MIRANDA DE EBRO,CS,,,
40.23821/SA,"GENERAL MARKETS FOOD IBERICA, S.A.U.",Salamanca/MONTALVO (EL),CS,,,
10.20890/SA,"CARNICAS SANTOS LOBO, S. L.",Salamanca/CARBAJOSA DE LA SAGRADA,"CS, CP, MM, MP",,,
10.20899/SA,"GENERAL MARKETS FOOD IBERICA, S.A.U.",Salamanca/CARBAJOSA DE LA SAGRADA,"CS, RW, MM, MP",,,
40.23851/ZA,"MEDINA-DUERO, S. L.",Zamora/ZAMORA,CS,,,
40.23869/VA,AITOR CARBALLO RUBIO,Valladolid/VALLADOLID,CS,,,
40.23962/VA,"SUPERCASH VALLADOLID, S. L. U.",Valladolid/VALLADOLID,CS,,,
10.20984/SG,"MENDOZA ARRANZ, S. L.",Segovia/CANTIMPALOS,PP,,MP,
10.21021/LE,"FRIGORIFICOS INDUSTRIALES DEL BIERZO,S.A",León/SAN ROMAN DE BEMBIBRE,"RW, PP",,MP,
15.06285/SO,PRODUCTOS CARNICOS LLORENTE S.A.,Soria/SORIA,CS,,,
10.21073/P,CLARA ISABEL BEZOS ESCUDERO,Palencia/FUENTES DE NAVA,PP,,MP,
40.24241/SG,"SERVICHEF GASTRONOMIA, S.L.",Segovia/LASTRILLA (LA),CS,,,
10.21098/SA,"IBERICOS LA ENCINA CHARRA, S. L.",Salamanca/GALLEGOS DE ARGAÑAN,PP,,MP,
12.17186/BU,"ANGULAS AGUINAGA, S.A.U.",Burgos/BURGOS,"PP, FFP",,,
10.21110/BU,"ARCECARNE, S.L.",Burgos/BURGOS,"CS, CP, MM, MP",,,
10.21137/SA,PINAJARRO ALIMENTACION S.L.,Salamanca/SORIHUELA,"MM, MP, PP",,MP,
14.02617/BU,"GRANJA AVICOLA CONEJERO, S. L.",Burgos/QUINTANAPALLA,EPC,,,
15.06329/VA,"PICO MELERO, E.S.P.J.",Valladolid/SARDON DE DUERO,"CS, PP",,,
40.24324/ZA,JOSE ANTONIO GARCIA BLANCO,Zamora/ZAMORA,CS,,,
10.21332/SA,"MATADERO FRIGORIFICO DE FUENTES, EL NAVAZO, S.L.",Salamanca/FUENTES DE BEJAR,"CS, SH, CP, PP",P,MP,
10.21342/SA,"CHACINAS IBERICAS DE LOS SANTOS, S. L.",Salamanca/SANTOS (LOS),"CP, PP",,MP,
40.24628/BU,"ALINOR, S. L.",Burgos/MIRANDA DE EBRO,CS,,,
40.24632/SA,MARTIN MATIAS ALMARAZ VIDA,Salamanca/SALAMANCA,CS,,,
40.24780/VA,VALENTIN MARTIN GALLEGO,Valladolid/MEDINA DEL CAMPO,CS,,,
40.24782/SA,"JAIGAL SALAMANCA, S.L.",Salamanca/POLIGONO INDUSTRIAL LOS VILLARES,CS,,,
14.02644/SG,"PEDAQUE, S. L.",Segovia/FUENTEMILANOS,EPC,,,
10.21445/SA,"INDUSTRIAS CARNICAS IGLESIAS, S. A.",Salamanca/MORIÑIGO,"RW, PP",,MP,
10.21446/ZA,MARIA DEL CARMEN ARES ALFONSO,Zamora/VILLALPANDO,"CP, MM, MP, PP",,MP,
10.21450/SG,"CARNICAS TABLADILLO, S. L.",Segovia/TABLADILLO,"CS, SH, CP, MM, MP",P,,
10.21469/SO,CARNICAS SIERRA DE TORANZO SL,Soria/OLVEGA,"CP, MM, MP, PP",,MP,
10.21483/SA,"CIPRIANO HERNANDEZ, S. A.",Salamanca/CARBAJOSA DE LA SAGRADA,"CS, RW, CP, MM, MP",,,
12.17515/SA,FRANCISCO JAVIER CUESTA SANCHEZ,Salamanca/SALAMANCA,CS,,,
10.21507/LE,OLGA BREZMES NICOLAS,León/MANSILLA DE LAS MULAS,"RW, PP",,MP,
15.06509/BU,"LACTEAS FLOR DE BURGOS, S.L.U.",Burgos/BURGOS,"PP, CC",,,
40.25000/SA,"HELMANTICA DE BEBIDAS, S. L.",Salamanca/SALAMANCA,CS,,,
40.25008/SG,VILLEGAS GAMIFER S.L.,Segovia/VALVERDE DEL MAJANO,CS,,,
10.21579/ZA,"ASOVINO, S.COOP.",Zamora/CORESES,"CS, CP",,,
15.06542/ZA,"EL PILAR, S. C.",Zamora/SANTA CRISTINA DE LA POLVOROSA,PP,,,
10.21617/AV,"CARNES BARBERO, S. L.",Ávila/BARRACO (EL),"CS, RW, SH, CP, PP","B, C, O",ST,
40.25090/VA,"CLAVO FOOD FACTORY, S.A.",Valladolid/TORDESILLAS,CS,,,
14.02662/P,"INDUSTRIAS CARNICAS SANTA MARINA, S. L.",Palencia/PALENCIA,CS,,,
40.25103/VA,"JVESA SERVICIOS FRIGORIFICOS, S. L.",Valladolid/MEDINA DEL CAMPO,CS,,,
12.17664/VA,"MARTINEZ DE QUEL, S.L.",Valladolid/VALLADOLID,CS,,,
10.21661/SA,INDUSTRIAS CARNICAS LORIENTE PIQUERAS S.A.,Salamanca/GUIJUELO,"RW, PP",,MP,
10.21662/SA,CARLOS PARRA SANCHEZ,Salamanca/LEDRADA,RW,,MP,
15.06586/ZA,"LACTEAS LA HINIESTA, S. L.",Zamora/HINIESTA (LA),PP,,,
40.25179/SA,"JAMONES J. J. SALAMANCA, S. L.",Salamanca/PEÑARANDA DE BRACAMONTE,CS,,,
10.21674/SO,"PRODUCTOS CARNICOS ALMAZAN, S. L.",Soria/ALMAZAN,"MM, MP, PP",,MP,
40.25199/AV,PEDRO GARCIA MARTIN,Ávila/COLILLA (LA),CS,,,
40.25201/VA,"ARRANZ AGUADO, S.L.",Valladolid/PEÑAFIEL,CS,,,
26.10378/ZA,"CASQUERIA SUSI, S.L.",Zamora/VILLARALBO,PP,,MP,
12.17739/P,"SELECTOS DE CASTILLA, S. A.",Palencia/VILLAMARTIN DE CAMPOS,CS,,,
10.21727/SG,"INCOVA CENTRO CARNICO, S. A.",Segovia/ESPINAR (EL),"CS, SH, CP, MM, MP",B,,
15.06617/SA,"HACIENDA ZORITA FARM FOODS, S.L.",Salamanca/SAN PELAYO DE GUAREÑA,PP,,,
10.21770/SG,"DOMINGO DE PEDRO MORENO E HIJOS, S. L.",Segovia/MATILLA (LA),"CP, PP",,MP,
10.21777/LE,"DE LO NUESTRO ARTESANO, S. L.",León/CARRACEDELO,PP,,MP,
10.21778/LE,"EMBUTIDOS HOMPANERA, S. L.",León/SANTAS MARTAS,"RW, PP",,MP,
26.10442/P,"INDUSTRIA GASTRONOMICA BLANCA MENCIA, S.L.",Palencia/DUEÑAS,PP,,MP,
40.25383/VA,"EXCLUSIVAS IRIS, S. L.",Valladolid/CISTERNIGA,CS,,,
40.25387/P,"INDUSTRIA GASTRONOMICA BLANCA MENCIA, S.L.",Palencia/DUEÑAS,CS,,,
10.21799/SA,"MECAQUIMICA, S. L.",Salamanca/SALAMANCA,CS,,,
10.21846/SA,"EMBUTIDOS FERMIN, S. L.",Salamanca/TAMAMES,"CS, RW, CP, PP",,MP,
15.06668/AV,"PRODUCTOS ARTESANOS VALDECABRAS, S. L.",Ávila/CANDELEDA,PP,,,
10.21873/BU,"CORDEROS LECHALES GALINDO, S. L.",Burgos/ARANDA DE DUERO,"CS, CP",,,
10.21888/SA,"CARNICAS SAVE, S. L.",Salamanca/SALAMANCA,"CS, CP",,,
10.21922/SA,ALINA MIHAELA BESTELIU .,Salamanca/GUIJUELO,"CS, RW",,MP,
14.02684/SG,ABILIO GARCIA GILSANZ,Segovia/BRIEVA,EPC,,,
10.21957/SA,"DEHESA DE GUIJUELO, S. L.",Salamanca/MONTEJO,"CS, PP",,MP,
10.21974/SA,"CARNICAS FRANJOVE, S. L.",Salamanca/SANTIBAÑEZ DE BEJAR,PP,,MP,
10.21975/SA,"JAMONES Y EMBUTIDOS HERMANOS MARTIN SANCHEZ, S. L.",Salamanca/SANTIBAÑEZ DE BEJAR,PP,,MP,
10.22002/SG,"EMBUTIDOS LOS SANPEDROS, S. L.",Segovia/SAN PEDRO DE GAILLOS,PP,,MP,
26.10672/BU,"ANGULAS AGUINAGA, S.A.U.",Burgos/BURGOS,PP,,,
10.22026/LE,POLLO RURAL GERAS S.L.,León/GERAS,RW,,,
10.22028/SA,"IBERICOS ARTESANOS J. SANZ, S. L.",Salamanca/ALDEATEJADA,RW,,MP,
10.22035/BU,MARIANO BEREZO PEREZ,Burgos/ESTEPAR,CP,,,
15.06780/SA,SOCIEDAD COOPERATIVA PUENTESAN,Salamanca/GOMECELLO,PP,,,
40.26001/VA,RANURE 2014 S.L.,Valladolid/VALLADOLID,CS,,,
15.06800/LE,"SUROLAIT, S. A.",León/ONZONILLA,PP,,,
40.26050/LE,"DISTRIBUCIONES ALONSO CANDANEDO, S. L.",León/ONZONILLA,CS,,,
10.22155/SA,"EXPLOTACIONES AGRICOLAS PASCUAL ALFONSO, S. L.",Salamanca/SALAMANCA,"CS, PP",,MP,
40.26106/VA,ANDRES GARCIA SANZ,Valladolid/VALLADOLID,CS,,,
15.06810/VA,SOCIEDAD COOPERATIVA CRICA,Valladolid/MEGECES,"RW, PP",,,
15.06833/ZA,"SUMINISTROS TEO CALPORC, S.L.",Zamora/BENAVENTE,"CS, PP",,,
40.26173/SG,C. B. JOSE ANTONIO SANCHO E HIJO,Segovia/GARCILLAN,CS,,,
26.10848/SG,RTE. JOSE MARIA EVENTOS S.L.,Segovia/SEGOVIA,PP,,MP,
12.18323/BU,"LANGUS SEAFOOD, S.L.",Burgos/BURGOS,CS,,,
10.22264/SA,"ATILANO GONZALEZ GOMEZ, S. L.",Salamanca/LEDRADA,PP,,MP,
10.22301/SA,"CESAR NIETO GROUP, S.L.",Salamanca/GUIJUELO,"CS, CP, PP",,MP,
40.26329/VA,"JORPESCA 2004, S. L.",Valladolid/PEÑAFIEL,CS,,,
10.22338/VA,CAMPABLICA S.L.,Valladolid/MAYORGA,PP,,MP,
10.22385/AV,"HERMANOS PERIBAÑEZ, C.B.",Ávila/AVILA,CP,,,
10.22452/BU,ALEJANDRO FERNANDEZ-VILLA GUTIERREZ-SOLANA,Burgos/ESPINOSA DE LOS MONTEROS,"SH, CP, PP",A,MP,
10.22453/SA,C. B. CARLOSAN,Salamanca/PUEBLA DE SAN MEDEL,PP,,MP,
10.22454/LE,JOSE MARCOS CARRERA FERNANDEZ,León/PRADORREY,"CS, CP, MM, MP, PP",,MP,
15.06921/LE,SOCIEDAD COOPERATIVA LIMITADA CEA ESLA,León/MANSILLA DE LAS MULAS,CC,,,
40.26616/SA,ENABOY CASTILLA S.L.,Salamanca/CASTELLANOS DE MORISCOS,CS,,,
15.06939/ZA,SOCIEDAD COOPERATIVA EL CARRIZAL DE CAMPOS,Zamora/TORRES DEL CARRIZAL,PP,,,
10.22538/SA,"ARTESANOS DEL IBERICO LA HUEBRA, S. L.",Salamanca/VECINOS,"CP, MM, MP, PP",,MP,
15.06952/BU,LACTEOS BUREBANOS S.L,Burgos/GRISALEÑA,PP,,,
10.22575/SA,"JAMON PRIM SALAMANCA, S. L.",Salamanca/MACOTERA,"CP, PP",,MP,
10.22576/SA,"DEHESA IBERICA LAS PLANAS, S.L.",Salamanca/CARBAJOSA DE LA SAGRADA,CS,,,
15.06977/ZA,"GANADINE 2004, S. L.",Zamora/MORALEJA DE SAYAGO,CS,,,
10.22676/ZA,"CARNICAS CASASECA, S. L.",Zamora/VALCABADO,"CS, RW",,,
10.22691/SO,"CARNES DE BUEY, S. L.",Soria/SORIA,CS,,,
40.27020/ZA,"SERZABE, S. L.",Zamora/CORESES,CS,,,
40.27023/SO,"DISTRIBUCIONES DISGAR SORIA, S.L.",Soria/SORIA,CS,,,
10.22698/SG,"SANCHONAR, S.L.U.",Segovia/SANCHONUÑO,"SH, CP, MM, MP, PP",A,MP,
10.22734/SA,JOSE CARLOS BARRIGA BARBERO,Salamanca/SANTA MARTA DE TORMES,CS,,,
10.22797/SA,"GRUPO ALIMENTARIO NATURIBER, S.L.U.",Salamanca/FUENTERROBLE DE SALVATIERRA,PP,,MP,
10.22799/SA,"MARDESA SALAMANCA, S. L.",Salamanca/SALAMANCA,"CS, RW, PP",,MP,
10.22801/SA,EUGENIA GARCIA MUÑOZ,Salamanca/GUIJUELO,CP,,,
10.22886/SA,"CABALLERO BENITO, S. L.",Salamanca/GUIJUELO,"CS, PP",,MP,
10.22891/ZA,ANDRES POMEDA IGLESIAS,Zamora/VILLARDECIERVOS,PP,,MP,
12.18974/VA,REPRESENTACIONES EXCLUSIVAS VILLAGARCIA S.L.,Valladolid/CISTERNIGA,PP,,,
14.02752/AV,DAVID GOMEZ PEREA,Ávila/PIEDRALAVES,EPC,,,
40.27383/VA,REPRESENTACIONES EXCLUSIVAS VILLAGARCIA S. L.,Valladolid/CISTERNIGA,CS,,,
40.27393/BU,"DISTRIBUIDORA INTERNACIONAL DE ALIMENTACION, S.A.",Burgos/MIRANDA DE EBRO,CS,,,
40.27394/SA,FRANCISCO DERECHO MARTIN,Salamanca/SALAMANCA,"CS, WM",,,
40.27395/SA,"ACEITUNAS DOMINGUEZ, S. A.",Salamanca/SALAMANCA,WM,,,
40.27460/ZA,"FITOSAN, S. L.",Zamora/CASTROGONZALO,CS,,,
10.22962/AV,JOSE MARIA VELAZQUEZ GONZALEZ,Ávila/NAVATALGORDO,"CP, PP",,MP,
26.11502/P,"SELECTOS DE CASTILLA, S. A.",Palencia/VILLAMARTIN DE CAMPOS,PP,,MP,
40.27539/BU,SOCIEDAD COOPERATIVA PROVINCIAL AVICOLA Y GANADERA DE BURGOS,Burgos/BURGOS,CS,,,
14.02758/SA,"INDUSTRIAS AGUSTIN RIESCO, S. L.",Salamanca/SALAMANCA,CS,,,
10.22984/ZA,"INDUSTRIAS CARNICAS FAMJOM, S. L.",Zamora/CORESES,SH,"C, O",,
14.02764/LE,"CANTOS BLANCOS NORTE, S. L.",León/VILLABRAZ,EPC,,,
10.23007/SA,"CARNICAS FRANJOVE, S. L.",Salamanca/GUIJUELO,"RW, PP",,MP,
10.23008/SA,"INDUSTRIAS AGUSTIN RIESCO, S. L.",Salamanca/SALAMANCA,"CS, WM",,,
10.23009/SA,"DEHESA LOS LINARILLOS, S. L. U.",Salamanca/GUIJUELO,PP,,MP,
10.23013/SA,FERMIN RAMOS RODRIGUEZ,Salamanca/GUIJUELO,PP,,MP,
40.27640/LE,"NAVAHER, S.L.",León/NAVATEJERA,CS,,,
40.27643/LE,"MERCADONA, S.A.",León/VILLADANGOS DEL PARAMO,CS,,,
10.23044/VA,ALEJANDRO REVILLA GOMEZ,Valladolid/VILLALON DE CAMPOS,"CP, MM, MP",,,
40.27755/SA,CARLOS ALBERTO LUIS CEJUDO,Salamanca/SALAMANCA,CS,,,
10.23081/BU,"EMBUTIDOS TRADICIONALES DE VILLARCAYO, S. L. U.",Burgos/VILLARCAYO,RW,,MP,
10.23099/SA,"CARNICAS MANROS, S. L.",Salamanca/GUIJUELO,PP,,MP,
10.23100/SA,"ENMERJOSA, S. L.",Salamanca/BEJAR,"RW, CP, MM, MP, PP",,MP,
15.07174/LE,OLGA HERNANDEZ GAGO,León/SAHECHORES DE RUEDA,PP,,,
10.23120/SG,"CARNICAS BRIZ, S.L.",Segovia/SEGOVIA,"CS, CP, MM, MP, PP",,MP,
10.23162/ZA,"CONTROL Y GESTION DEL PORCINO 2010, S.L.",Zamora/ROALES,RW,,MP,
40.27987/AV,"AVES VAZQUEZ, S. L.",Ávila/AVILA,CS,,,
40.27988/BU,"EMBUTIDOS LA MIRANDESA, S. L.",Burgos/MIRANDA DE EBRO,CS,,,
10.23181/AV,MARIA JOSE DOÑATE LOPEZ,Ávila/COLILLA (LA),"MM, MP, PP",,MP,
15.07215/BU,"FUENTE HUMORERA, S. L.",Burgos/RIOSECO,PP,,,
10.23243/AV,CARNICAS CARLOS BLANCO S. L. U.,Ávila/AREVALO,"CS, SH, CP","P, fG",,
40.28143/LE,"EMBUTIDOS GEAL, S. L.",León/FERRAL DEL BERNESGA,CS,,,
40.28147/VA,"DISTRIBUCIONES MIGUEL ANGEL 2009, S. L.",Valladolid/SANTOVENIA DE PISUERGA,CS,,,
10.23286/BU,"ARCEPIEL, S. L.",Burgos/BURGOS,PP,,ST,
10.23305/SA,"IBERICOS BECAR LEDRADA, S.L.",Salamanca/LEDRADA,PP,,MP,
40.28318/VA,"COVADUL FAST FOOD, S.L.",Valladolid/VALLADOLID,CS,,,
10.23367/SA,"JOSE LUIS BERROCAL E HIJOS, S. L.",Salamanca/GALLEGOS DE SOLMIRON,PP,,MP,
10.23369/SA,"GAGO IBERICO HAM & NATURAL MEAT, S.L.",Salamanca/CASTELLANOS DE MORISCOS,"CS, RW, PP",,MP,
15.07295/ZA,BODEGAS Y VIÑEDOS FERNANDEZ RIVERA S.L.,Zamora/VADILLO DE LA GUAREÑA,PP,,,
10.23410/SA,JOSE INOCENTE DOMINGUEZ DOMINGUEZ,Salamanca/SANTIBAÑEZ DE BEJAR,"RW, PP",,MP,
10.23440/SA,SOCIEDAD COOPERATIVA IBERICOS DEHESA GRANDE,Salamanca/VITIGUDINO,"RW, PP",,MP,
10.23488/SA,"JAMONES QUERCUS,S.A.",Salamanca/BEJAR,PP,,MP,
10.23491/SA,"AGUSTIN LUIS GOMEZ E HIJOS, S.A.",Salamanca/GUIJUELO,PP,,MP,
40.28631/BU,"COMERCIAL BURGALESA DE DISTRIBUCION 2008, S. L. U.",Burgos/BURGOS,CS,,,
10.23541/BU,"GENERAL MARKETS FOOD IBERICA, S.A.U.",Burgos/BURGOS,"CP, MM, MP, PP",,MP,
12.19649/BU,"DIEGO PORCELOS, S.A.",Burgos/BURGOS,CS,,,
14.02809/SO,"AVICOLA CIRIA, S.L.",Soria/ALDEALAFUENTE,EPC,,,
40.28763/SA,DISTRIBUCIONES DISALSO S.L.,Salamanca/POLIGONO INDUSTRIAL LOS VILLARES,CS,,,
10.23635/SA,"EMBUTIDOS FILI, S.L.",Salamanca/NAVALES,CP,,,
10.23636/LE,"COMERCIO Y DISTRIBUCION DE ALIMENTOS EL LLANO, S.L.",León/VILORIA DE LA JURISDICCION,"CP, MM, MP, PP",,MP,
10.23648/SA,DAVID HERNANDEZ GONZALEZ,Salamanca/SANTIBAÑEZ DE BEJAR,PP,,MP,
12.19788/P,"SEMARK AC GROUP, S.A.",Palencia/VILLAMURIEL DE CERRATO,CS,,,
26.12247/BU,"EMBUTIDOS DE CARDEÑA, S.L.",Burgos/CARDEÑADIJO,PP,,MP,
15.07413/AV,AGROSENO S.L.,Ávila/PALACIOS RUBIOS,PP,,,
40.29036/P,"DISDEPA 2010, S.L.",Palencia/PALENCIA,CS,,,
10.23705/SG,"CONTODO, S.L.",Segovia/CUELLAR,PP,,MP,
40.29119/BU,UNION DETALLISTAS ESPAÑOLES SOCIEDAD COOPERATIVA UNIDE,Burgos/BURGUETA,"CS, RW",,,
40.29120/BU,COMERCIAL ARADUER S.L.,Burgos/ARANDA DE DUERO,CS,,,
10.23722/LE,VICENTE BERERIDE CORULLON,León/TORAL DE LOS VADOS,"CP, MM, MP, PP",,"BL, MP",
15.07428/P,EVA MARIA MARCOS TARTILAN,Palencia/FUENTES DE NAVA,PP,,,
40.29196/LE,"PALCARSA, S.L.",León/SAN JUSTO DE LA VEGA,RW,,,
40.29197/LE,"MANOLO GARCIA EMBUTIDOS DE CALIDAD, S.L.",León/VILLAMAÑAN,CS,,,
10.23768/BU,ALFREDO ALONSO MARTINEZ,Burgos/LERMA,PP,,MP,
15.07446/SA,"QUESOS NAVAS,S.L.",Salamanca/PEÑARANDA DE BRACAMONTE,PP,,,
14.02830/AV,"GRANJA MONTE ENCINAR, S.L.",Ávila/BARRACO (EL),EPC,,,
40.29383/SO,"EXCLUSIVAS OMEÑACA, S.L.",Soria/SORIA,CS,,,
40.29384/AV,"SERVIDONA, S.L.",Ávila/BRIEVA-VICOLOZANO,CS,,,
40.29403/SO,JESUS ANGEL LAFUENTE ARCHE,Soria/SORIA,CS,,,
10.23797/SA,SALCAT-2000 S.L.,Salamanca/GUIJUELO,,,,
14.02834/VA,"CASA COLEGIO MAYOR MENENDEZ PELAYO PROVINCIA DE ESPAÑA, COMPAÑIA DE JESUS",Valladolid/VALLADOLID,EPC,,,
26.12458/P,"CONSERVAS Y ELABORADOS SILVERSET, S.L.",Palencia/ARENILLAS DE SAN PELAYO,PP,,MP,
40.29511/AV,AVES CANDELEDA C.B.,Ávila/CANDELEDA,CS,,,
40.29575/SA,SERVIDONA S.L.,Salamanca/BEJAR,CS,,,
10.23845/LE,"CARNICAS CARLU, S.L.",León/RIBASECA,"CS, CP, MM, MP, PP",,MP,
40.29770/LE,"REINO DE LEON EXCLUSIVAS Y DISTRIBUCIONES, C.B.",León/SAN PEDRO DE LAS DUEÑAS,CS,,,
10.23877/BU,ELACAM PRODUCTOS ELABORADOS DEL CAMPO S.L.,Burgos/HOYALES DE ROA,"SH, CP",A,,
10.23880/BU,INDUSTRIAS CARNICAS LOPE S.L.,Burgos/BURGOS,"CS, RW, CP, MM, MP",,,
15.07518/SA,MARIA DEL PILAR SANTOS GOMEZ,Salamanca/SANTIBAÑEZ DE LA SIERRA,PP,,,
40.30034/LE,"VALDELLAN, S. A.",León/SANTA MARIA DEL MONTE DE CEA,RW,,,
10.23899/SG,ALIMENTACION SANZ VEGAS S.L.,Segovia/CASLA,PP,,MP,
40.30082/P,"EXCLUSIVA EPI TV, S.L.",Palencia/VILLALOBON,CS,,,
10.23906/BU,"LA MAJADA DE BARCINA DE LOS MONTES, S.C.",Burgos/BARCINA DE LOS MONTES,CS,,,
40.30151/ZA,ENABOY CASTILLA S.L.,Zamora/BENAVENTE,CS,,,
40.30152/SA,DISHERGON HOSTELERIA Y ALIMENTACION S.L.,Salamanca/VILLARES DE LA REINA,CS,,,
40.30154/VA,JUSTINO GUTIERREZ S.L.,Valladolid/LAGUNA DE DUERO,CS,,,
40.30163/SA,"ALMACEN FRIGORIFICO SALVA, S.L.",Salamanca/CARBAJOSA DE LA SAGRADA,CS,,,
40.30166/LE,"EUROQUES, S.L.",León/RIBASECA,"CS, RW",,,
40.30389/LE,"LA BANDERA CARNES SELECTAS, S.L.",León/LEON,"CS, RW",,,
10.23926/ZA,JOSE MANUEL CACHON SOBEJANO,Zamora/SANTA CRISTINA DE LA POLVOROSA,PP,,MP,
15.07500/LE,C.B. LA BRAÑA,León/PALACIOS DEL SIL,PP,,,
12.20012/BU,LANGUS SEAFOOD S.L.,Burgos/BURGOS,"PP, FFP",,,
15.07503/AV,DIAZ COLORADO S.C.,Ávila/NAVAS DEL MARQUES (LAS),PP,,,
10.23958/LE,INDUSTRIAS CARNICAS VICENTE E HIJAS S.L.,León/TORAL DE LOS VADOS,"CP, MM, MP, PP",,MP,
40.30860/SA,GRUPO EL ARBOL DISTRIBUCION Y SUPERMERCADOS S.A.,Salamanca/DOÑINOS DE SALAMANCA,CS,,,
40.30889/ZA,ALMAZARA LOS VIVALES S.L.,Zamora/SANZOLES,CS,,,
40.31439/VA,"CASADO RODRIGUEZ, ANDRES ANGEL",Valladolid/MEDINA DEL CAMPO,CS,,,
40.31446/SA,"HERNANDEZ GONZALEZ, DAVID",Salamanca/SANTIBAÑEZ DE BEJAR,CS,,,
10.23995/SA,"AURELIO CARRERO, S.L.",Salamanca/SALAMANCA,"CS, RW, WM",,,
15.07520/VA,GRANJA CANTAGRULLAS. S.L.,Valladolid/RAMIRO,PP,,,
15.07529/LE,DANIEL GONZALEZ GONZALEZ,León/QUINTANILLA DE SOLLAMAS,"CS, PP",,,
15.07536/VA,"HEREDEROS DE RIVERA ROMAN, S.L.",Valladolid/PESQUERA DE DUERO,PP,,,
10.24071/AV,COMERCIALIZADORA DE VACUNO SELECTO AVILEÑO NEGRO IBERICO S.C.L.,Ávila/AVILA,"CP, MM, MP",,,
10.24073/SA,"DE LUIS CALAMA, ANTONIO EMILIANO",Salamanca/MOGARRAZ,PP,,MP,
10.24084/BU,"PARADILLA 143, S.L.U.",Burgos/PARDILLA,PP,,MP,
15.07549/AV,"ENCABO NIEVA, EUGENIO",Ávila/NAVANDRINAL,PP,,,
40.33511/SG,MESENOR SOCIEDAD COOPERATIVA LIMITADA,Segovia/CARBONERO EL MAYOR,CS,,,
40.33518/VA,VINOS DE ALTA EXPRESION S.L.,Valladolid/VALLADOLID,CS,,,
15.07551/LE,"MANCEBO DEL AMO, JOSE MANUEL",León/VILLAQUILAMBRE,PP,,,
12.20242/SA,"VALLE SANCHEZ, FELIX OMAR",Salamanca/BEJAR,CS,,,
40.34206/VA,"ABASTOS CASTELLANOS, S.L.",Valladolid/SANTOVENIA DE PISUERGA,CS,,,
40.34207/VA,FRIGORIFICOS SALAMANCA S.L.,Valladolid/VALLADOLID,"CS, RW",,,
40.34208/VA,ALIMENTOS EL ARCO S.A.,Valladolid/PINAR DE ANTEQUERA,RW,,,
40.34215/SA,DELICATESSEN J.J. SALAMANCA S.L.,Salamanca/VILLARES DE LA REINA,CS,,,
12.20260/BU,"DAMPEIX 2011,, S. L.",Burgos/BURGOS,PP,,,
12.20261/BU,"CENTRAL BURGALESA DE PESCADOS, S.L.",Burgos/BURGOS,PP,,,
10.24164/BU,"CARNICAS CHICO, S.L.",Burgos/ARANDA DE DUERO,"CS, RW, CP, MM, MP",,MP,
40.34871/LE,"SETAS FRUTOBOS, S.L.U.",León/TORAL DE LOS GUZMANES,CS,,,
15.07564/ZA,"CAPRINO DEL ESLA, S.L.",Zamora/PALACIOS DEL PAN,PP,,,
10.24192/SA,"IBERLINARES, S.L.",Salamanca/LINARES DE RIOFRIO,"CS, CP, MM, MP, PP",,MP,
15.007579/ZA,"DE VEGA POSADA, PEDRO",Zamora/TAPIOLES,PP,,,
10.024240/SA,CARNICAS JOSE Y CASILLAS S.L.,Salamanca/GUIJUELO,CP,,,
12.020358/VA,ALBAOLID 2009 S.L.,Valladolid/VALLADOLID,"CS, RW, PP",,,
12.020376/VA,"GAMBANATURAL DE ESPAÑA, S. L.",Valladolid/MEDINA DEL CAMPO,"RW, PP",,,
10.024264/VA,"CARNICAS DE LUGUILLAS, S.L.",Valladolid/MOJADOS,"MM, MP, PP",,MP,
10.024265/BU,"MONZON RASERO, RAMON",Burgos/VILLALBA DE DUERO,SH,A,,
14.002876/AV,"RODRIGUEZ GARCIA, PILAR",Ávila/MAELLO,EPC,,,
12.020399/P,COMUNIDAD DE PROPIETARIOS C/ EXTREMADURA 13,Palencia/PALENCIA,WM,,,
12.020402/P,"CABO VIRGENES ESPAÑA, S.L.U.",Palencia/PALENCIA,"CS, PP",,,
14.002878/ZA,"CASARES GONZALEZ, MARIA DEL CANTO",Zamora/TORO,EPC,,,
40.037080/BU,"T2 BURGOS, S.L.",Burgos/VILLAGONZALO PEDERNALES,CS,,,
40.037083/LE,"TRANSPORTES ALCANA LEON, S.L.",León/ONZONILLA,CS,,,
10.024312/LE,JORGE ROJO GONZALEZ,León/VECILLA DE CURUEÑO (LA),PP,,MP,
10.024315/SA,"DISCARGUI, S.L.",Salamanca/GUIJUELO,RW,,,
40.037367/ZA,"DISTRIBUCIONES GARCIA FERRERO 2011, S.L.",Zamora/ZAMORA,CS,,,
15.007618/BU,MARIA NIEVES ORTIZ FERNANDEZ,Burgos/ESPINOSA DE LOS MONTEROS,PP,,,
10.024345/SA,"MANUEL ANGEL RODRIGUEZ, S.C.",Salamanca/CAMPILLO DE SALVATIERRA,PP,,MP,
10.024382/LE,CARNICAS Y EMBUTIDOS GOYO GARCIA S.L.,León/SAN ROMAN DE LA VEGA,PP,,MP,
15.007638/VA,"QUESERIAS ENTREPINARES, S.A.U.",Valladolid/VALLADOLID,"CS, RW, PP",,,
40.038547/ZA,ABACERIA DEL MONASTERIO S.L.,Zamora/BENAVENTE,CS,,,
26.013523/SA,ROVALSA INDUSTRIA ALIMENTARIA S.L.,Salamanca/VALDECARROS,PP,,MP,
40.038827/BU,DAMPEIX 2011 S.L.,Burgos/BURGOS,CS,,,
10.024400/SA,"ILANJA, S.L.",Salamanca/GUIJUELO,PP,,MP,
40.039045/VA,"FRIGORIFICOS ALVAREDO, S.L.",Valladolid/VALLADOLID,CS,,,
40.039046/ZA,"SERVIDONA, S.L.",Zamora/ZAMORA,CS,,,
40.039047/BU,"GAMBASTAR, S.L.",Burgos/VALDORROS,RW,,,
40.039048/VA,"CONGELADOS MIGUEL, S.A.",Valladolid/VALLADOLID,CS,,,
40.039049/SG,"SEMARK AC GROUP, S.A.",Segovia/HONTORIA,CS,,,
40.039895/AV,"VIANDAS CASTELLANAS, S.L.",Ávila/SOLANA DE RIOALMAR,CS,,,
10.024432/SG,"CASTRO RODRIGUEZ E HIJOS, S.L.",Segovia/CANTIMPALOS,PP,,MP,
10.024443/SA,"ALMACENES BENITO GARCIA, S.A.",Salamanca/GUIJUELO,PP,,MP,
40.040249/AV,"MIGUEL ANGEL JIMENEZ SANCHIDRIAN, C.B.",Ávila/AVILA,CS,,,
40.040358/AV,"CONGELADOS GARGA ABULENSES, S.L.",Ávila/COLILLA (LA),CS,,,
40.040455/VA,"GADISA RETAIL, S.L.",Valladolid/MEDINA DEL CAMPO,CS,,,
40.040457/P,"PRECOPAL, S.L.",Palencia/PALENCIA,CS,,,
5.000003/VA,INSTITUTO TECNOLOGICO AGRARIO DE CASTILLA Y LEON,Valladolid/VALLADOLID,PP,,,
10.024476/SA,"RAZAPORK, S.L.",Salamanca/SALAMANCA,CS,,,
12.020636/ZA,"PROXIMAR, S.L.",Zamora/BENAVENTE,CS,,,
40.040649/SA,ASOCIACION BANCO DE ALIMENTOS DE SALAMANCA,Salamanca/SALAMANCA,CS,,,
14.002915/BU,"SANTA ROSALIA GOURMET, S.L.",Burgos/VIZMALO,EPC,,,
40.041332/SG,FELIX SANCHEZ JOAO,Segovia/LASTRILLA (LA),CS,,,
40.041539/VA,"UNIDAD ALIMENTARIA DE VALLADOLID, S.A.",Valladolid/VALLADOLID,WM,,,
40.041541/P,CDAD PROP MERCADO CENTRAL MERCAPASA,Palencia/VILLAMURIEL DE CERRATO,WM,,,
40.041545/AV,"SAGA DISMAGREDOS, S.L.",Ávila/ARENAS DE SAN PEDRO,CS,,,
15.007663/LE,JOSE VIDAL FERNANDEZ BLANCO,León/SAN MIGUEL DE ESCALADA,"RW, PP",,,
10.024505/LE,"GRUPO CANORTE, S.L.",León/CEMBRANOS,"CS, MM, MP, PP",,MP,
10.024517/LE,"CARNICAS CARROBIERZO, S.L.",León/CASTRILLO DE LAS PIEDRAS,"CS, RW, CP, PP",,MP,
40.041763/SA,"PRODUCTOS CONGELADOS JOSE LUIS, S.L.L.",Salamanca/VILLARES DE LA REINA,CS,,,
40.041794/LE,GABRIEL GONZALEZ FERNANDEZ,León/BAÑEZA (LA),"CS, RW",,,
14.002919/VA,JUAN GAY DOMENECH,Valladolid/MEGECES,EPC,,,
10.024528/LE,"JAMONES ANTONIO MARTINEZ, S.L.",León/ASTORGA,PP,,MP,
40.041966/LE,"LOGISTICAS Y SERVICIOS JAÑEZ, S.L.",León/VEGUELLINA DE ORBIGO,CS,,,
40.041969/SA,"EXCLUSIVAS ANGEL FERNANDEZ, S.L.",Salamanca/CARBAJOSA DE LA SAGRADA,CS,,,
40.041973/SO,"COCO GOURMET GASTRONOMIA, S.L.",Soria/SORIA,CS,,,
14.002921/LE,MANUEL CORDERO PEREZ,León/SAN CRISTOBAL DE LA POLANTERA,EPC,,,
14.002923/AV,"GANSO DE LA CORNEJA, S.L.",Ávila/VILLAFRANCA DE LA SIERRA,EPC,,,
40.042234/VA,"ALEMAR SELECCION, S.L.",Valladolid/VALLADOLID,CS,,,
10.024564/SG,JONATHAN ALONSO SALAMANCA,Segovia/RIAZA,PP,,MP,
12.020757/ZA,"PESCADOS ZAMORA, S.L.",Zamora/ZAMORA,CS,,,
15.007685/SO,INMACULADA A. HERRAEZ HURTADO,Soria/SAN PEDRO MANRIQUE,"RW, PP",,,
10.024591/SA,"SUCESORES DE JOSE PEREZ, S.L.",Salamanca/ALARAZ,PP,,MP,
15.007686/SO,"MYKES GOURMET, C.B.",Soria/SORIA,"RW, PP",,,
10.024609/SA,"CARLOS DEMETRIO, S.L.",Salamanca/GUIJUELO,RW,,ST,
40.043129/VA,"EXPLOTACIONES ABADIA, S.A.",Valladolid/MONTEMAYOR DE PILILLA,CS,,,
40.043408/AV,"SELECTOS FRAGOLA, S.L.L.",Ávila/ADRADA (LA),CS,,,
15.007704/AV,"ALIGARMA, S.L.",Ávila/BARRACO (EL),PP,,,
15.007705/P,"QUESERIA ARTESANA SANTA MARIA DE QUINTANAHERNANDO, S.L.",Palencia/SALINAS DE PISUERGA,PP,,,
14.002937/SG,"EL EJIDILLO VIVEROS INTEGRALES, S.L.",Segovia/VALDESIMONTE,EPC,,,
15.007717/LE,ALMUDENA PEREZ DOMINGUEZ,León/MATALOBOS DEL PARAMO,PP,,,
12.020856/VA,"MERCAFISH 2012, S.L.",Valladolid/VALLADOLID,CS,,,
40.044059/BU,"GRUPO DELINCEX, S.L.",Burgos/ARANDA DE DUERO,CS,,,
40.044924/LE,"INDUSTRIAL ZARRACINA, S.A.",León/TROBAJO DEL CAMINO,CS,,,
40.044956/VA,"JUTECA, S.L.",Valladolid/ZARATAN,CS,,,
14.002968/SA,ANGEL LOPEZ MARTIN,Salamanca/VILLAR DE CIERVO,EPC,,,
40.045295/ZA,"PICAPULPO, S.L.",Zamora/SANTOVENIA,CS,,,
10.024812/LE,"DISTRIBUCIONES CARNICAS LAS MEDULILLAS, S.L.U.",León/PONFERRADA,"CS, RW, CP, MM, MP",,MP,
10.024815/AV,MANUEL BLANCO MARTIN,Ávila/BURGOHONDO,"CP, PP",,MP,
26.014314/SG,"LA PESGA 962, S.L.",Segovia/ANGELES DE SAN RAFAEL (LOS),PP,,MP,
40.045951/SA,"MERCADOS CENTRALES DE ABASTECIMIENTO DE SALAMANCA, S.A.",Salamanca/SALAMANCA,WM,,,
40.045973/BU,JESUS VEGANZONES MATE,Burgos/ROA,CS,,,
40.045980/LE,"FABRICA DE EMBUTIDOS EL PINAR, S. L.",León/VILLAOBISPO DE LAS REGUERAS,CS,,,
10.024853/P,"CARNICAS ODRIOZOLA, S.L.",Palencia/PALENCIA,CS,,,
10.024886/BU,"REUSAD EMPRESA DE INSERCION, S.L.",Burgos/BURGOS,PP,,MP,
10.024903/LE,FERNANDO FUERTES FUERTES,León/CARRIZO DE LA RIBERA,PP,,MP,
40.046643/AV,"ALICONFRE, S.L.",Ávila/AVILA,CS,,,
40.046646/VA,"HERMANOS RODRIGUEZ BARBANCHO, S.L.",Valladolid/CISTERNIGA,CS,,,
10.024914/LE,"OVIGAR GANADOS DE LEON, S.L.",León/OTERUELO DE LA VALDONCINA,"SH, CP, PP","C, O",ST,
40.046784/AV,"CARLEST & DANY, S.L.",Ávila/TIÑOSILLOS,CS,,,
10.024931/LE,"EMBUTIDOS ARTESANOS BERCIANOS, S.L.L.",León/TORAL DE MERAYO,PP,,MP,
10.024947/SO,EMBUTIDOS ALVIC S.L.,Soria/AGREDA,"MM, MP, PP",,MP,
40.047197/SA,"PRO DACAR, C.B.",Salamanca/PEÑARANDA DE BRACAMONTE,CS,,,
40.047436/SA,ALBERTO GONZALEZ DIAZ,Salamanca/CARBAJOSA DE LA SAGRADA,CS,,,
