Nº RGSEAA (*),Razón Social,Provincia/Localidad,Actividades,Especies (**),Otros Detalles,TSE Feed Ban
14.00145/BU,"ARTEOVO, S. L.U.",Burgos/ARANDA DE DUERO,PP,,,
14.00152/VA,"HIJOS DE ATILANO SAMPEDRO, S. L.",Valladolid/SAN MIGUEL DEL PINO,EPC,,,
14.00169/VA,MARCOPOLO COMERCIO S.L.,Valladolid/ALDEAMAYOR DE SAN MARTIN,"PP, EPC, LEP",,,
14.00179/VA,S.A.T. NUM. 569 SAN MIGUEL,Valladolid/VILLALAN DE CAMPOS,EPC,,,
14.00183/VA,"GRANJA PINILLA, S. L.",Valladolid/MEGECES,EPC,,,
14.00188/P,"HUEVOS DE CAMPOS, S. L.",Palencia/MENESES DE CAMPOS,EPC,,,
14.00194/BU,SOCIEDAD AGRARIA DE TRANSFORMACION SAT Nº 1751 GRANJA HIMA,Burgos/MELGAR DE FERNAMENTAL,EPC,,,
14.00225/LE,RUBEN GONZALEZ VIÑUELA,León/LORENZANA,EPC,,,
14.00227/VA,JOSE JAVIER CERRO GONZALO,Valladolid/PEDRAJA DE PORTILLO (LA),EPC,,,
14.00238/BU,"AVICOLA ALVAREZ, S. L.",Burgos/VILLADIEGO,EPC,,,
14.00257/LE,GRANJA RUALMAR S.L.,León/OLLEROS DE ALBA,"CS, EPC",,,
14.00315/P,COOPERATIVA AGRICOLA NUESTRA SEÑORA DE LA ASUNCION,Palencia/ABIA DE LAS TORRES,EPC,,,
14.00337/SG,"PRODUCCIONES AVICOLAS EL GRANJERO, S. L.",Segovia/CUELLAR,EPC,,,
14.00343/VA,"GERARDO DE LUCAS, S. L.",Valladolid/CABEZON DE PISUERGA,EPC,,,
14.00394/AV,"AVICOLA BARCO, S. L.",Ávila/BERLANAS (LAS),EPC,,,
14.00400/BU,"A.P.G. COMERCIAL PALENCIA, S. L.",Burgos/VILLARCAYO,EPC,,,
14.00631/BU,MARTINEZ MARAÑON LUIS SANTAMARIA RUIZ MARINA S. C.,Burgos/MEDINA DE POMAR,EPC,,,
14.00690/BU,"GRANJAS SAGREDO, S. A.",Burgos/BRIVIESCA,EPC,,,
14.00717/SO,"MARTINEZ Y RASO, S. L.",Soria/OLVEGA,EPC,,,
14.00731/VA,CESAR NOVO MUÑOZ,Valladolid/PEÑAFIEL,EPC,,,
14.00740/P,"GRANJA COTO VERDE, S. L.",Palencia/AMUSCO,EPC,,,
14.00883/LE,IGNACIO ANDRES GARCIA,León/OLLEROS DE ALBA,EPC,,,
14.01019/VA,"GRANJA AVICOLA ALAVA, S.L.U.",Valladolid/SIMANCAS,EPC,,,
14.01104/SG,S.A.T. 1627 PORCINAGUILA,Segovia/AGUILAFUENTE,EPC,,,
14.01105/P,"NAVEROS MI-ALON, SOCIEDAD COOPERATIVA",Palencia/NAVEROS DE PISUERGA,EPC,,,
14.01165/SA,"MARTIN PIERNA, C.B.",Salamanca/PARADINAS DE SAN JUAN,EPC,,,
14.01183/VA,"AVICOLA ALTO RUBI, S. L.",Valladolid/VALLADOLID,EPC,,,
14.01184/SO,JAVIER DE LA VILLA MARINA,Soria/SORIA,CS,,,
14.01188/SA,"AGROPECUARIA EL CHINARRAL, S.L.",Salamanca/MONTEJO,EPC,,,
14.01468/AV,CARLOS GONZALEZ FERNANDEZ,Ávila/NAVALUENGA,EPC,,,
14.01560/VA,"EXPLOTACIONES AVICOLAS GARCIA PUENTE, S. A.",Valladolid/OLMEDO,EPC,,,
14.01586/AV,"AVICOLA JIMENEZ, S. L.",Ávila/POZANCO,EPC,,,
14.01713/VA,C.B. MARCIAL PEREZ SANGRADOR E HIJOS,Valladolid/ISCAR,EPC,,,
14.01769/BU,S.A.T. Nº 1.117 HERMANOS MARTINEZ GARCIA,Burgos/HONTORIA DE LA CANTERA,EPC,,,
14.01785/SG,AVICOLA VELASCO S. L.,Segovia/VILLACASTIN,"CS, EPC",,,
14.01837/SA,PEDRO GOMEZ SILLERO,Salamanca/SALAMANCA,CS,,,
14.01973/SG,C. B. HERMANOS MIGUEL BAHAMONTES,Segovia/VALLERUELA DE PEDRAZA,EPC,,,
14.01977/SG,"PRODUCCIONES AVICOLAS EL GRANJERO, S. L.",Segovia/SAN CRISTOBAL DE CUELLAR,EPC,,,
14.02027/VA,"GRANJA PINILLA, S. L.",Valladolid/ALCAZAREN,EPC,,,
15.00011/ZA,"QUESERIAS DE ZAMORA, S. A.",Zamora/MORALES DEL VINO,PP,,,
15.00021/LE,INDUSTRIAS LACTEAS CABO Y FERNANDEZ S.L.,León/VALENCIA DE DON JUAN,"PP, CC",,,
15.00027/BU,"FRIAS NUTRICION,S.A.",Burgos/BURGOS,"CS, PP",,,
15.00042/LE,MONDELEZ ESPAÑA PRODUCTION S.L.,León/HOSPITAL DE ORBIGO,PP,,,
15.00048/ZA,"LECHE GAZA, S. L.",Zamora/ZAMORA,PP,,,
15.00052/VA,"EL GRAN CARDENAL, S. A.",Valladolid/MEDINA DEL CAMPO,PP,,,
15.00068/LE,"LACTIBER LEON, S. L.",León/TROBAJO DEL CERECEDO,PP,,,
15.00079/SA,"FELIPE HERNANDEZ VACAS, S. L.",Salamanca/HINOJOSA DE DUERO,"PP, CC",,,
15.00094/VA,"INDUSTRIAS LACTEAS DE PEÑAFIEL, S. L. U.",Valladolid/PEÑAFIEL,"RW, PP, CC",,,
15.00097/ZA,"INDUSTRIAS LACTEAS BENAVENTANAS, S. A.",Zamora/BENAVENTE,PP,,,
15.00099/LE,"QUESOS PINIELLA FORCELLEDO, S. L.",León/SAHAGUN,PP,,,
15.00120/ZA,"LACTEAS CASTELLANO LEONESAS, S. A.",Zamora/FRESNO DE LA RIBERA,"CS, PP",,,
15.00132/VA,"QUESOS QUEVEDO, S. L.",Valladolid/VALORIA LA BUENA,PP,,,
15.00155/VA,"QUESOS HERMANOS GAMAZO CARBAJOSA, S. A.",Valladolid/MELGAR DE ARRIBA,PP,,,
15.00158/VA,"GRUPO QUESOS CANAL, S.L.",Valladolid/VALLADOLID,PP,,,
15.00169/ZA,PABLO ALONSO MARTIN,Zamora/VILLALPANDO,PP,,,
15.00174/LE,"GABINO PEREZ, S. L.",León/MATALLANA DE VALMADRIGAL,PP,,,
15.00175/VA,"QUESOS B. R., S. L.",Valladolid/CAMPILLO (EL),"PP, CC",,,
15.00194/LE,"INDUSTRIAS LACTEAS MANZANO, S. A.",León/VALDERAS,PP,,,
15.00206/LE,"PIEDRA LOS MARTIRES, S. L.",León/BOCA DE HUERGANO,PP,,,
15.00220/BU,CALIDAD PASCUAL S.A.U.,Burgos/ARANDA DE DUERO,"PP, CC",,,
15.00227/LE,"A. TASCON DE LEON, S. A.",León/VILLACEDRE,PP,,,
15.00228/LE,"INDUSTRIAS LACTEAS SAN VICENTE, S.L.",León/NAVATEJERA,PP,,,
15.00248/BU,"PRODUCTOS LACTEOS OVEJERO, S. A.",Burgos/BRIVIESCA,PP,,,
15.00249/BU,"MANTEQUERIAS ARIAS, S. A.",Burgos/VILLALONQUEJAR,"CS, PP, CC",,,
15.00251/VA,"QUESERIAS SAIZ, S.A.",Valladolid/SARDON DE DUERO,PP,,,
15.00253/ZA,"INDUSTRIAS LACTEAS MARTIN FERNANDEZ, S. L.",Zamora/TAPIOLES,PP,,,
15.00261/ZA,"QUESOS REVILLA, S.L.",Zamora/CORESES,PP,,,
15.00262/LE,QUESERIAS PICOS DE EUROPA S.L.,León/POSADA DE VALDEON,PP,,,
15.00264/ZA,"QUESOS EL PASTOR - HIJOS DE SALVADOR, S.A.",Zamora/SANTA CRISTINA DE LA POLVOROSA,PP,,,
15.00272/P,"HIJOS DE JULIAN HERNANDEZ, C.B.",Palencia/CARRION DE LOS CONDES,PP,,,
15.00283/P,"QUESOS CERRATO, S. COOP.",Palencia/BALTANAS,"CS, PP",,,
15.00296/VA,"QUESOS MUÑIZ, S. A.",Valladolid/MOJADOS,PP,,,
15.00297/VA,"HEREDEROS DE FELIX SANZ, S. L.",Valladolid/SERRADA,PP,,,
15.00307/AV,C. B. QUESERIA DE CASTILLA,Ávila/PALACIOS DE GODA,PP,,,
15.00321/VA,"QUESERIAS DE CASTROMONTE, S. L.",Valladolid/CASTROMONTE,PP,,,
15.00323/P,"QUESOS CREGO, S.L.",Palencia/CEVICO DE LA TORRE,PP,,,
15.00331/BU,LAFUENTE CARRERAS JOSE LORENZO Y CARLOS SC,Burgos/BUSTO DE BUREBA,PP,,,
15.00332/ZA,"SEVERO MARCOS, S. A.",Zamora/TORO,PP,,,
15.00339/ZA,"LACTALIS ZAMORA, S.L.U.",Zamora/ZAMORA,"CS, PP",,,
15.00351/P,"QUESERIA IBERICA AT, S.L.",Palencia/HERRERA DE PISUERGA,PP,,,
15.00354/P,JOSE GAMAZO BENITO,Palencia/QUINTANA DEL PUENTE,PP,,,
15.00357/VA,JUAN MARTINEZ S. L.,Valladolid/MAYORGA,"PP, CC",,,
15.00365/BU,"MANTEQUERIA LAS NIEVES, S. A.",Burgos/ESPINOSA DE LOS MONTEROS,PP,,,
15.00377/P,"QUESERIAS EUSEBIO MANZANO, S. L.",Palencia/PALENCIA,PP,,,
15.00408/BU,EXPLOTACION AGRICOLA VENTOSILLA S.A.,Burgos/GUMIEL DE MERCADO,PP,,,
15.00427/LE,"QUESOS MARSAN, S. A.",León/VALENCIA DE DON JUAN,"RW, PP",,,
15.00468/P,JUAN CARLOS ARENILLAS PELAYO,Palencia/BECERRIL DE CAMPOS,PP,,,
15.00471/ZA,"PIGLETS, S.L.",Zamora/CORESES,PP,,,
15.00476/P,CISTERCIENSE ORDEN MONASTERIO SAN ISIDRO,Palencia/DUEÑAS,PP,,,
15.00499/VA,"MANTEQUERIAS ARIAS, S. A.",Valladolid/CORCOS,"PP, CC",,,
15.00501/ZA,"QUESERIAS CHILLON PLAZA, S. L.",Zamora/TORO,PP,,,
15.00505/P,"QUESOS MUÑIZ AZPELETA, S. L.",Palencia/MELGAR DE YUSO,PP,,,
15.00540/SA,"GARCIA FILLOY, S. L.",Salamanca/FREGENEDA (LA),"PP, CC",,,
15.00568/SG,"LACTEAS RUMA, S.L.",Segovia/NAVAS DE SAN ANTONIO,PP,,,
15.00701/SA,"QUESOS ABADENGO, S. L.",Salamanca/SOBRADILLO,PP,,,
15.00750/AV,"QUESERIAS DEL TIETAR, S. L.",Ávila/ADRADA (LA),PP,,,
15.00879/ZA,"PROLACTEA, S. A.",Zamora/CASTROGONZALO,PP,,,
15.00926/BU,HERMANOS SADORNIL CASTRILLO S.L,Burgos/SASAMON,PP,,,
15.00958/VA,"QUESERIAS ENTREPINARES, S. A.U.",Valladolid/VALLADOLID,"PP, CC",,,
15.01048/BU,"BODEGAS RAIZ Y QUESOS PARAMO DE GUZMAN, S. L.",Burgos/CUEVA DE ROA (LA),PP,,,
15.01081/ZA,"LACTEAS ZAMORO, S. L.",Zamora/SANTIBAÑEZ DE VIDRIALES,PP,,,
15.01221/P,"GANADERA DE LA NAVA 2010, S. L.",Palencia/CASCON DE LA NAVA,PP,,,
15.01233/SG,JORGE TRIVIÑO ROMANO,Segovia/ESPIRDO,PP,,,
15.01331/BU,GANADERIA BERTA S. A..,Burgos/VILLARCAYO,PP,,,
15.01352/VA,JULIO ALBERTO HERNANDEZ GARCIA,Valladolid/CASTRONUÑO,PP,,,
15.01410/BU,"QUESOS LOS ALTOS, S,C.",Burgos/DOBRO,PP,,,
15.01412/BU,"QUESOS RICO, S. L.",Burgos/VILLASILOS,"CS, PP",,,
15.01472/BU,"LACTEOS RUIZ ANGULO, S. L.",Burgos/BURGOS,PP,,,
15.01539/AV,"MASOVIC 1984, S.L.",Ávila/AVILA,CS,,,
15.01568/ZA,SOCIEDAD COOPERATIVA AGROVIPAS,Zamora/MORALES DEL VINO,PP,,,
15.01618/BU,JOSE MANUEL ARNAIZ BUSTO,Burgos/BARCINA DE LOS MONTES,PP,,,
15.01692/BU,ELENA LOPEZ UZAL,Burgos/LLORENGOZ,PP,,,
15.01715/BU,LA CUEVA DE VADORREY S.L.,Burgos/CUEVA DE ROA (LA),PP,,,
15.01729/AV,SOCIEDAD COOPERATIVA PRODUCTORES DE OVINO COMARCA DE AREVALO,Ávila/DONJIMENO,CC,,,
15.01771/LE,"VEIGADARTE, S. L.",León/AMBASMESTAS,PP,,,
15.01790/SA,"CONSORCIO DE PROMOCION DEL OVINO, S.COOP.",Salamanca/VALDERRODRIGO,CC,,,
15.01792/SA,JUAN GARCIA GORJON,Salamanca/VILVESTRE,PP,,,
15.01863/BU,SOCIEDAD COOPERATIVA HERMANOS PARAMO,Burgos/ARENILLAS DE RIOPISUERGA,PP,,,
15.01964/LE,"LACTEAS VILLARROMANA, S. L.",León/VILLAQUILAMBRE,PP,,,
15.02116/LE,S. A. T. EL SENDERO,León/COLADILLA,PP,,,
15.02215/AV,SOCIEDAD COOPERATIVA LIMIT.GANADEROS DE CAPRINO DEL ALBERCHE,Ávila/BARRACO (EL),CC,,,
15.02238/AV,GANADEROS DE CAPRINO DE CANDELEDA SDAD.COOP.LTDA.,Ávila/CANDELEDA,CC,,,
15.02243/AV,"CAPRINO DE CANDELEDA, S. L.",Ávila/CANDELEDA,PP,,,
15.02344/P,S. A. T. Nº 9338 HERMANOS PARAMIO,Palencia/VILLERIAS DE CAMPOS,PP,,,
15.02346/BU,ANA MARIA SOTO TAPIA,Burgos/HINESTROSA,PP,,,
15.02419/ZA,FRANCISCO JOSE MARTINEZ MARTINEZ,Zamora/FORNILLOS DE FERMOSELLE,PP,,,
15.02497/BU,"DISTRIBUCIONES PENTASA BURGOS, S. A.",Burgos/BURGOS,CS,,,
15.02535/VA,"T.G.T. CASTILLA, S. A.",Valladolid/CABEZON DE PISUERGA,CS,,,
15.02602/SA,SARA HERNANDEZ IGLESIAS,Salamanca/BOGAJO,PP,,,
15.02611/SA,ANTONIO SANCHEZ MARTIN,Salamanca/LAGUNILLA,PP,,,
15.02673/SA,VICENTE PUENTE LOPEZ,Salamanca/LAGUNILLA,PP,,,
15.02752/LE,SOCIEDAD COOPERATIVA VEGA ESLA,León/TORAL DE LOS GUZMANES,"PP, CC",,,
15.02792/LE,ARTESANOS DE LUNA S.L.,León/SAELICES DEL PAYUELO,PP,,,
15.02809/AV,SOCIEDAD COOPERATIVA LIMITADA ALTA MORAÑA,Ávila/SAN PEDRO DEL ARROYO,"CS, PP",,,
15.02827/VA,"LACTEOS ARTESANOS MEDINA, S. L.",Valladolid/RUEDA,PP,,,
15.02836/VA,"CAÑAREJAL, S. L.",Valladolid/POLLOS,PP,,,
15.02839/AV,S. A. T. CABREROS DE LA SIERRA DE AVILA,Ávila/SOLANA DE RIOALMAR,PP,,,
15.02877/ZA,ANDRES CAMPO MATEOS,Zamora/CUELGAMURES,PP,,,
15.02893/ZA,ALONSO SANTOS DE PEDRO,Zamora/FARIZA,PP,,,
15.02919/P,NURIA GONZALEZ COLLAZOS,Palencia/VILLAUMBRALES,PP,,,
15.02955/BU,SOCIEDAD COOPERATIVA PARAMO DE URTAZA,Burgos/ARLANZON,PP,,,
15.02994/SO,"QUESERIAS QUESONCALA, S. L.",Soria/ONCALA,"CS, PP",,,
15.03035/BU,"R. CASANUEVA, S. L.",Burgos/SALAS DE LOS INFANTES,PP,,,
15.03079/SG,MIGUEL MAYO HERRERO,Segovia/ARMUÑA,PP,,,
15.03099/LE,SARA MATEO TOMAS,León/ESPEJOS DE LA REINA (LOS),PP,,,
15.03123/BU,JESUS MARIA ANDRES HIDALGO,Burgos/BURGOS,PP,,,
15.03226/SA,BENJAMIN GOMEZ FERNANDEZ S.L.,Salamanca/SALAMANCA,CS,,,
15.03339/AV,"ORNUA INGREDIENTES ESPAÑA, S.L.U.",Ávila/BRIEVA-VICOLOZANO,PP,,,
15.03401/SA,PEDRO ANTONIO DELGADO GARCIA,Salamanca/MONLERAS,PP,,,
15.03535/SA,"QUESERIAS IGLESIAS, S. L.",Salamanca/VITIGUDINO,PP,,,
15.03536/P,FELIX TARILONTE SASTRE,Palencia/LAGUNILLA DE LA VEGA,PP,,,
15.03615/LE,"ASTURLESA-CENTRAL QUESERA, S. A.",León/MANSILLA DE LAS MULAS,PP,,,
15.03848/ZA,RICARDO MAGARZO FERNANDEZ,Zamora/CIBANAL,PP,,,
26.00001/VA,"FINDUS ESPAÑA, S.L.U.",Valladolid/VALLADOLID,PP,,MP,
26.00030/BU,"EURO FRITS, S. A.",Burgos/BURGOS,PP,,MP,
26.00239/ZA,"FREIGEL FOODSOLUTIONS, S. A.",Zamora/ROALES,PP,,MP,
26.02340/SO,"HERNANDEZ MENDO, S. L.",Soria/SORIA,PP,,MP,
26.03635/SG,"PRECOCINADOS FUENTETAJA, S. L.U.",Segovia/MUDRIAN,"CS, PP",,,
26.04241/VA,"CLAVO FOOD FACTORY, S.A.",Valladolid/TORDESILLAS,PP,,MP,
26.05479/SO,"APERITIVOS DE AÑAVIEJA, S. A.",Soria/MURO,PP,,MP,
26.05785/BU,RAMON MONZON RASERO,Burgos/VILLALBA DE DUERO,PP,,MP,
40.00502/BU,"GENERAL MARKETS FOOD IBERICA, S.A.U.",Burgos/ARANDA DE DUERO,CS,,,
40.00532/LE,"HIPERMERCADOS Y ECONOMATOS, S. A.",León/FUENTES NUEVAS,CS,,,
40.00595/LE,"FRIO DE LEON, S. L.",León/SAN ANDRES DEL RABANEDO,CS,,,
40.00677/AV,"FRIGORIFICOS SANCHIDRIAN, S.L.",Ávila/SANCHIDRIAN,CS,,,
40.00702/BU,"FRIO BURGOS, S. A.",Burgos/BURGOS,CS,,,
40.00834/SA,"QUEJUSA, S. L.",Salamanca/SANTIBAÑEZ DE BEJAR,CS,,,
40.00840/SG,"CONGELADOS DE SEGOVIA, S. L.",Segovia/VALVERDE DEL MAJANO,CS,,,
40.00919/SG,POVESA,Segovia/HONTORIA,CS,,,
40.00925/SA,"GRUPO EL ARBOL DISTRIBUCION Y SUPERMERCADOS, S. A.",Salamanca/SALAMANCA,"CS, WM",,,
40.01169/BU,"AGUSTIN DOMINGUEZ RODRIGUEZ, S. L.",Burgos/MIRANDA DE EBRO,CS,,,
40.01229/VA,"COMERCIAL DISTRIBUCION, S. A. CODISA",Valladolid/VALLADOLID,CS,,,
40.01275/BU,"INDUSTRIAS CARNICAS CASTELLANAS, S. A.",Burgos/BURGOS,CS,,,
40.01627/SA,ALIMENTOS CONGELADOS RUFO S.L.,Salamanca/CIUDAD RODRIGO,CS,,,
40.01737/P,"GRUPO EL ARBOL DISTRIBUCION Y SUPERMERCADOS, S. A.",Palencia/PALENCIA,CS,,,
40.01812/P,ALMACENES BENIGNO GARCIA CUESTA S. L,Palencia/VILLALOBON,CS,,,
40.01878/ZA,ANDRES FERRERO E HIJOS S.L.,Zamora/ZAMORA,CS,,,
40.02046/ZA,"DISTRIBUCIONES DELGADO, S.L.",Zamora/CORESES,CS,,,
40.02060/SA,"HIJOS DE EULOGIO SANCHEZ, S. L.",Salamanca/POLIGONO INDUSTRIAL LOS VILLARES,CS,,,
40.02263/LE,"DISTRIBUCIONES HOFER 2018, S.L.",León/ARCAHUEJA,CS,,,
40.02761/LE,"REPRESENTACIONES ALONSO, S. A.",León/VILLACEDRE,CS,,,
40.02857/SA,"HERMANOS BUENO JIMENEZ, S. A.",Salamanca/MACOTERA,CS,,,
40.02870/SG,"LLORENTE PARDO, S. L.",Segovia/SEGOVIA,CS,,,
40.02938/SG,"FRILOZAM, S. L.",Segovia/HONTORIA,CS,,,
40.03209/BU,"RODRIGUEZ Y RENES, S. L.",Burgos/BURGOS,CS,,,
40.03435/BU,"ULTRACONGELADOS AMPARO, S. L.",Burgos/BURGOS,CS,,,
40.03436/LE,DISTRIBUIDORA CARNICA LEONESA S.L.,León/VILLAOBISPO DE LAS REGUERAS,CS,,,
40.03516/P,"COCIMAR 2002, S.L.",Palencia/PALENCIA,CS,,,
40.03685/LE,"DISTRIBUCIONES EUGENIO ALVAREZ, S. A.",León/VILLAOBISPO DE LAS REGUERAS,CS,,,
40.04171/LE,"HEREDEROS DE ELICERIO Y JESUSA, S. L.",León/PONFERRADA,CS,,,
40.04221/BU,"CONGELADOS ORBESA, S. A.",Burgos/VILLAYUDA O LA VENTILLA,CS,,,
40.04232/SO,"COMERCIAL HERMANOS ORTEGA, S. A.",Soria/SORIA,CS,,,
40.04352/LE,MONDELEZ ESPAÑA PRODUCTION S.L.,León/HOSPITAL DE ORBIGO,"CS, RW",,,
40.05583/VA,"MAKRO AUTOSERVICIO MAYORISTA, S. A.",Valladolid/VALLADOLID,CS,,,
40.06480/ZA,COVIRAN SOCIEDAD COOPERATIVA ANDALUZA,Zamora/ZAMORA,CS,,,
40.06560/P,"DISTRIBUCIONES MOTA BARTOLOME, S. L.",Palencia/PALENCIA,CS,,,
40.06785/SO,FRISORIA S.A.,Soria/SORIA,CS,,,
40.06828/P,"DISTRIBUCIONES ALCOPA, S. L.",Palencia/PALENCIA,CS,,,
40.06893/LE,"ANOVI, S. L.",León/BAÑEZA (LA),CS,,,
40.06923/SG,"DISTRIBUC.ALIMENTARIAS SAN LORENZO, S. L",Segovia/LASTRILLA (LA),CS,,,
40.07110/VA,"DISTRIBUCIONES MIGUEL Y MOREJON, S. L.",Valladolid/VALLADOLID,CS,,,
40.07204/VA,"DISTRIBUCIONES DE ALIMENTACION MARTINEZ PASTOR, S. L.",Valladolid/VALLADOLID,CS,,,
40.07221/SG,"FELIFRU, S.L.",Segovia/HONTORIA,CS,,,
40.07290/LE,"COMEDORES COLECTIVOS DE CELIS, S. L.",León/NAVATEJERA,CS,,,
40.07372/LE,"COVIRAN, S.C.A.",León/PONFERRADA,CS,,,
40.07386/SO,"JOSE ANTONIO MARTINEZ DIEZ, S. L.",Soria/SORIA,CS,,,
40.07490/SO,"MERCHANDALIMENT, S. L.",Soria/SORIA,CS,,,
40.07622/VA,COMERCIAL JAVIER CASADO S.L.,Valladolid/VALLADOLID,CS,,,
40.07650/VA,"DISTRIBUIDORA INTERNACIONAL DE ALIMENTACION, S.A.",Valladolid/VILLANUBLA,CS,,,
40.07712/SA,"CONGELADOS MATA Y MARTIN, SL",Salamanca/SALAMANCA,CS,,,
40.07884/AV,FREILE S.L.,Ávila/AVILA,CS,,,
40.07893/BU,"COMERCIAL BASCONES, S. L.",Burgos/BURGOS,CS,,,
40.08063/BU,"DISTRIBUCIONES BASTIDA, S. L.",Burgos/MIRANDA DE EBRO,CS,,,
40.08065/BU,"COMERCIAL MILOR MIRANDA, S. L.",Burgos/MIRANDA DE EBRO,CS,,,
40.08112/LE,"CLEMENTE MADRIGAL, S. A.",León/FUENTES NUEVAS,CS,,,
40.08342/LE,"REPRESENTACIONES BLANCO, S. L.",León/PONFERRADA,CS,,,
40.08384/BU,"CARJUL ARANDA, S.L.",Burgos/ARANDA DE DUERO,CS,,,
40.08414/LE,DISTRIBUCIONES GRAN BIERZO S.L.,León/CAMPO,CS,,,
40.08444/SA,"PESCADOS LA CORUÑA PEÑARANDA, S. L.",Salamanca/PEÑARANDA DE BRACAMONTE,CS,,,
40.08527/BU,"EXCLUSIVAS HERMANOS BARREDA, S. L.",Burgos/BURGOS,CS,,,
40.08586/VA,"GUTIERREZ SANZ E HIJOS, S. L.",Valladolid/VALLADOLID,CS,,,
40.08587/VA,"ALIMENTACION FRIORIZADA DE VALLADOLID, S. L.",Valladolid/VALLADOLID,CS,,,
40.08631/VA,"PESCADOS ARRANZ, S. L.",Valladolid/PEÑAFIEL,CS,,,
40.08714/LE,"EXCLUSIVAS ANDRES, S. A.",León/ASTORGA,CS,,,
40.08901/AV,"ANGUR 2014, S.L.",Ávila/ARENAS DE SAN PEDRO,CS,,,
40.09125/BU,"GRUPO EL ARBOL DISTRIBUCION Y SUPERMERCADOS, S.A.",Burgos/BURGOS,CS,,,
40.09132/P,"DISTRIBUCIONES JESUS PALENZUELA, S. L.",Palencia/PALENCIA,CS,,,
40.09211/VA,QUALIANZA SERVICIOS INTEGRALES DE DISTRIBUCION S.L.,Valladolid/VALLADOLID,CS,,,
40.09244/VA,MANUEL BLANCO BLAZQUEZ,Valladolid/VALLADOLID,CS,,,
40.09366/P,"REPRESENTACIONES LUVAN, S. L. UNIPERSONAL",Palencia/PALENCIA,CS,,,
40.09402/BU,"CENTRO DE TRANSPORTES ADUANA DE BURGOS, S.A.",Burgos/VILLAFRIA,CS,,,
40.09462/BU,"LOGISTICA SAIZ ORTEGA, S.L.",Burgos/ARANDA DE DUERO,CS,,,
40.09551/LE,"DISMA MEDULAS, S. L.",León/PONFERRADA,CS,,,
40.09552/LE,"LUFAG, S. L.",León/VALDELAFUENTE,"CS, RW",,,
40.09799/VA,COMERCIAL AVICOLA CABALLO BLANCO S.L.,Valladolid/VILLALON DE CAMPOS,CS,,,
40.09810/BU,"CODISAL CASTELLANA, S.L.",Burgos/QUINTANILLA DE LAS CARRETAS,CS,,,
40.09851/P,"ALFONSO PEÑA, S. L.",Palencia/PALENCIA,CS,,,
40.09937/LE,"PALENZUELA LOGISTICA, S. L.",León/ONZONILLA,CS,,,
40.10133/SO,C. B. SARNAGO DISTRIBUCION,Soria/OLVEGA,"CS, RW",,,
40.10155/SG,DISTRALICON S. L.,Segovia/HONTORIA,CS,,,
40.10261/SO,"COMERCIAL HERMANOS MORENO, S. L.",Soria/SORIA,CS,,,
40.10271/SA,"DISTRIBUCIONES COPAN, S. L.",Salamanca/VILLARES DE LA REINA,CS,,,
40.10425/SA,"DISCOSA DE ALIMENTACION, S. L.",Salamanca/VILLARES DE LA REINA,CS,,,
40.10426/SA,"DISTRIBUCION DE ALIMENTACION SALMANTINA, S. L.",Salamanca/POLIGONO INDUSTRIAL,CS,,,
40.10447/VA,GELFRIMAR S. L.,Valladolid/VALLADOLID,CS,,,
40.10564/LE,"V & B SANTIAGO NISTAL, S. L.",León/VILLACEDRE,CS,,,
40.10597/BU,"ANTONIO DIAZ LUIS, S. L.",Burgos/BURGOS,CS,,,
40.10650/BU,JOSE OSCAR ZUNZUNEGUI ARMAS,Burgos/MIRANDA DE EBRO,CS,,,
40.10651/VA,"MARTINEZ DE QUEL, S. L.",Valladolid/TORDESILLAS,CS,,,
40.10837/LE,"DISPONFER, S. L.",León/CAMPONARAYA,CS,,,
40.10981/LE,JOSE JAVIER GUTIERREZ DEL VALLE,León/SAN ANDRES DEL RABANEDO,CS,,,
40.10983/P,DISTRIBUCIONES M. FERNANDEZ MARTINEZ S.L.,Palencia/PALENCIA,CS,,,
40.11262/LE,"COMERCIAL OBLANCA, S. A.",León/PONFERRADA,CS,,,
40.11264/AV,NADISCON DE DISTRIBUCION ALIMENTARIA S.L.,Ávila/NARRILLOS DE SAN LEONARDO,CS,,,
40.11358/LE,"CONGELADOS BIERZOCAR, S. L.",León/PARANDONES,CS,,,
40.11380/P,"COMERCIAL EUTIMIO MERINO, S. L.",Palencia/PALENCIA,CS,,,
40.11533/LE,"SUMINISTROS Y DERIVADOS DE CONGELADOS Y FRIO DE LEON, S. L.",León/SANTOVENIA DE LA VALDONCINA,CS,,,
40.11580/BU,LUIS DE PABLO DEL CURA,Burgos/ARANDA DE DUERO,CS,,,
40.11595/P,JORGE INFANTE GARCIA,Palencia/VILLAMURIEL DE CERRATO,"CS, WM",,,
40.11710/ZA,FADIS ALIMENTACION S. L.,Zamora/ZAMORA,CS,,,
40.11719/VA,"DIMAS OTERO, S. A.",Valladolid/VALLADOLID,CS,,,
40.11816/VA,NEMESIO LAFUENTE SEBASTIAN,Valladolid/ZARATAN,CS,,,
40.11823/BU,"DIALCO ARANDA, S. L.",Burgos/ARANDA DE DUERO,CS,,,
40.11978/BU,FERNANDO DE LA CRUZ CALVO,Burgos/BURGOS,CS,,,
40.11992/LE,"1995 DILC, S. L.",León/CAMPONARAYA,CS,,,
40.12073/LE,"CERVECERA LEONESA, S.L.",León/VALDELAFUENTE,CS,,,
40.12109/VA,"SUPERMERCADOS LA SALVE, S.L.",Valladolid/ARRABAL DE PORTILLO,CS,,,
40.12110/VA,"FADIS ALIMENTACION, S. L.",Valladolid/ARROYO DE LA ENCOMIENDA,CS,,,
40.12174/LE,IBERCELTICA ALIMENTARIA S.L.,León/PONFERRADA,CS,,,
40.12210/VA,"ULTRACONGELADOS DONA DONA, S. L.",Valladolid/TORDESILLAS,CS,,,
40.12284/SG,UNION DETALLISTAS ESPAÑOLES SOCIEDAD COOPERATIVA UNIDE,Segovia/SEGOVIA,CS,,,
40.12424/BU,"ANGEL GARCIA ALONSO, S. L.",Burgos/BURGOS,CS,,,
40.12446/BU,"LOGISTICA Y VENTA DE CONGELADOS ALTAMAR, S. A. L.",Burgos/BURGOS,CS,,,
40.12460/SG,"DISTRIBUCIONES J. L. SANZ, S. L.",Segovia/VALVERDE DEL MAJANO,CS,,,
40.12480/BU,"FRIGORIFICOS GESFRIO, S. L.",Burgos/BURGOS,CS,,,
40.12575/AV,"DISTRIBUCIONES ABAD 2019, S.L.",Ávila/BRIEVA-VICOLOZANO,"CS, RW",,,
40.12625/P,"REFRIGERADOS ANDRES Y RAMOS, S.L.",Palencia/PALENCIA,CS,,,
40.12753/VA,HECTOR DAVID ARRIBAS CALDERON,Valladolid/CISTERNIGA,CS,,,
40.12841/P,"ELMAR FROZEN FOOD, S.L.U.",Palencia/PALENCIA,CS,,,
40.12864/BU,"CAMPOFRIO FOOD GROUP, S.A.U.",Burgos/VILLAFRIA,CS,,,
40.12873/SA,"DIMEVA, S. L.",Salamanca/VILLARES DE LA REINA,CS,,,
40.12876/SA,UNION DETALLISTAS ESPAÑOLES SOCIEDAD COOPERATIVA UNIDE,Salamanca/SALAMANCA,"CS, WM",,,
40.12916/VA,EUXIQUIO MULERO GARCIA,Valladolid/VALLADOLID,CS,,,
40.12978/P,"EXLUAL, S.L.",Palencia/HERRERA DE PISUERGA,CS,,,
40.12997/LE,"RODRIGUEZ ALEGRE, S. L.",León/BAÑEZA (LA),CS,,,
40.13044/SG,REPRESENTACIONES RINCON S.L.,Segovia/HONTORIA,CS,,,
40.13046/LE,"CONGELADOS GUTIERREZ SERRANO, S.L.",León/TROBAJO DEL CAMINO,CS,,,
40.13125/VA,"GENERAL MARKETS FOOD IBERICA, S.A.U.",Valladolid/VALLADOLID,CS,,,
40.13236/SA,"CONGELADOS SALUDA, S. L.",Salamanca/CIUDAD RODRIGO,CS,,,
40.13238/SA,"HELADOS LA POLAR, S. L.",Salamanca/POLIGONO INDUSTRIAL,CS,,,
40.13348/AV,"PLACOR 2006, S. L.",Ávila/AVILA,CS,,,
40.13425/BU,RICARDO SAIZ GONZALEZ,Burgos/VILLALBILLA DE BURGOS,CS,,,
40.13491/BU,"CONGELADOS ROMIVA, S.L.",Burgos/MIRANDA DE EBRO,CS,,,
40.13503/LE,"ELMAR FROZEN FOOD, S.L.U.",León/PONFERRADA,CS,,,
40.13570/BU,"SELECCIONES ALEJANDRO CARRILLO, S. L.",Burgos/BURGOS,CS,,,
40.13594/SA,"DISTRIBUCIONES COMERCIALES OLEGARIO ALONSO, S. L.",Salamanca/VILLARES DE LA REINA,CS,,,
40.13607/VA,EXCLUSIVAS CASTELLANO LEONESAS DE ALIMENTACION S.L.,Valladolid/VALLADOLID,CS,,,
40.13634/SA,"CANELA FROZEN, S.L.",Salamanca/SALAMANCA,CS,,,
40.13820/SA,"GRUPO EL ARBOL DISTRIBUCION Y SUPERMERCADOS, S. A.",Salamanca/PEÑARANDA DE BRACAMONTE,CS,,,
40.13892/SA,LOFRISA S.L.L.,Salamanca/VILLARES DE LA REINA,CS,,,
40.13949/LE,"EL CUMBRAL 1, S. A.",León/ONZONILLA,CS,,,
40.14132/BU,"DISTRIBUCIONES LASANBUR, S.L.",Burgos/BURGOS,CS,,,
40.14164/VA,"CONGELADOS FRIOJESA, S. L.",Valladolid/VALLADOLID,CS,,,
40.14282/SG,COMERCIAL SEGOFOOD S.L.,Segovia/HONTORIA,CS,,,
40.14383/VA,"ELMAR FROZEN FOOD, S.L.U.",Valladolid/VALLADOLID,CS,,,
40.14389/VA,"HERMANOS OBLANCA, S. L.",Valladolid/CISTERNIGA,CS,,,
40.14451/BU,"EXCLUSIVAS REYCAS, S. L.",Burgos/CASTAÑARES,CS,,,
40.14452/BU,"BURVENDING, S. L.",Burgos/BURGOS,CS,,,
40.14565/ZA,"IGNACIO DE LAS CUEVAS, S.A.",Zamora/ZAMORA,CS,,,
40.14568/SA,"COMERCIAL LAGO LUCAS, S. L.",Salamanca/VILLARES DE LA REINA,CS,,,
10.14824/SA,"GARCIGRANDE DE BELLOTA, S. L.",Salamanca/GUIJUELO,RW,,MP,
10.14852/SA,JAMONES Y EMBUTIDOS SALGADO SL,Salamanca/ROBLIZA DE COJOS,PP,,MP,
10.14889/SG,"JAMONES SEGOVIA, S. A.",Segovia/CARBONERO EL MAYOR,"CS, PP",,MP,
10.14890/SG,"RODRIGUEZ SACRISTAN, S. L.",Segovia/CUELLAR,CS,,,
40.14689/LE,"COMERCIAL ALVARID, S. L.",León/CAMPONARAYA,"CS, RW",,,
40.14693/LE,MERCALEON S.A.,León/LEON,WM,,,
10.14899/SA,C. B. CARNICAS SIERRA DE TONDA C.B.,Salamanca/PUEBLA DE SAN MEDEL,"CP, PP",,MP,
10.14903/VA,"LA DESPENSA CASTELLANA, S.L.",Valladolid/VALLADOLID,"CP, MM, MP, PP",,MP,
10.14913/SG,"JAMONES Y EMBUTIDOS SANCHO, S. L.",Segovia/CARBONERO EL MAYOR,PP,,MP,
10.14914/LE,"EMBUTIDOS JONAS, S. L.",León/VILLAMUÑIO,PP,,MP,
40.14701/VA,HIJOS DE EUGENIO DEL CAÑO S. A.,Valladolid/VALLADOLID,CS,,,
12.10732/LE,"DE LO NUESTRO ARTESANO, S. L.",León/CARRACEDELO,"RW, PP",,,
15.03907/P,"QUESOS MATILLA, S. L.",Palencia/LANTADILLA,PP,,,
15.03916/VA,"QUESOS HERNANDEZ GARCIA, S. L.",Valladolid/VILLALBA DE LOS ALCORES,PP,,,
10.14944/SA,"CARNICAS GREGORIO RODRIGUEZ, S. L.",Salamanca/LEDRADA,PP,,MP,
10.14954/ZA,C. B. EMBUTIDOS SANCHEZ MARBAN,Zamora/TORO,"CP, PP",,MP,
10.14955/SO,"HERMANOS MARIN BOROBIO, S. L.",Soria/ALMENAR DE SORIA,"MM, MP, PP",,MP,
15.03950/P,"AGRIPEBA, S.L.",Palencia/FROMISTA,PP,,,
40.14797/BU,"GENERAL MARKETS FOOD IBERICA, S.A.U.",Burgos/BURGOS,CS,,,
40.14799/ZA,"GRUPO EL ARBOL DISTRIBUCION Y SUPERMERCADOS, S. A.",Zamora/ZAMORA,CS,,,
40.14800/AV,TOMAS SANTOS JARA,Ávila/ARENAS DE SAN PEDRO,CS,,,
40.14857/SO,"COMERCIAL JAMONES ALONSO, S. L.",Soria/OLVEGA,CS,,,
10.15018/SA,"AURELIO CARRERO, S.L.",Salamanca/SALAMANCA,"CS, RW, WM, CP, MM, MP",,,
40.14908/VA,"DISTRIBUIDORA GENERAL ALAVESA, S. A.",Valladolid/VALLADOLID,CS,,,
12.10853/VA,"PESCARMAR, S. L.",Valladolid/VALLADOLID,"CS, RW",,,
15.03977/SO,PRODUCTOS DE CALIDAD CAÑADA REAL S.A.,Soria/SORIA,"PP, CC",,,
10.15029/VA,"CARNICAS VILLACELES, S.L.",Valladolid/VALLADOLID,"CS, CP",,,
15.03985/VA,"QUESERA NAPOLI, S. L.",Valladolid/OLMEDO,PP,,,
40.14929/BU,"COMERCIAL ARLANZA DE DISTRIBUCIONES,S.L.",Burgos/BURGOS,CS,,,
40.14965/BU,"GENERAL MARKETS FOOD IBERICA, S.A.U.",Burgos/BURGOS,CS,,,
40.14966/SA,"MONTEFER, S. L.",Salamanca/VILLARES DE LA REINA,CS,,,
40.14972/BU,"GRUPO ALIMENTARIO BURGALES, S. L.",Burgos/CASTAÑARES,CS,,,
12.10931/VA,"ALVAREDO CONGELADOS, S. L.",Valladolid/VALLADOLID,CS,,,
40.15023/ZA,"DISTRIBUCIONES FIDALGO VECINO, S. L.",Zamora/ZAMORA,"CS, RW",,,
15.04037/AV,ARTURO ARENILLAS ASIN,Ávila/CANDELEDA,PP,,,
14.02109/BU,Mª ANGELES IRAZABAL FERNANDEZ,Burgos/BELORADO,EPC,,,
10.15161/SG,ANGEL LUIS BURGOS CABRERO,Segovia/COBOS DE SEGOVIA,PP,,MP,
40.15190/SG,"SANCHEZ VAZQUEZ HNOS, S.A",Segovia/SEGOVIA,CS,,,
10.15221/P,JOSE MANUEL ODRIOZOLA QUINTANO,Palencia/SALDAÑA,SH,"P, B, C, O, S",,
40.15213/BU,"EUSKASOL, S.L.U.",Burgos/BURGOS,CS,,,
15.04077/LE,"LA MOLDERA REAL, S. L.",León/SANTIAGO MILLAS,PP,,,
10.15276/ZA,"CARNICAS JAVIER ESTEBAN, S. L.",Zamora/POBLADURA DEL VALLE,PP,,MP,
26.06444/AV,"GRUPO INDUSTRIAL PANCHO MEX, S. L.",Ávila/CANDELEDA,PP,,MP,
40.15269/VA,MARIA MONTSERRAT SAN JOSE CABEZAS,Valladolid/VALLADOLID,CS,,,
10.15312/VA,"CUAJOS CAPORAL, S. L.",Valladolid/CISTERNIGA,"RW, PP",,ST,
10.15321/SA,"MONTESIERRO DE SALAMANCA, S.L.",Salamanca/NAVALES,"CP, PP",,MP,
10.15344/SA,"INVERSIONES JOFER, S. L.",Salamanca/GUIJUELO,CP,,,
10.15361/AV,"AVES VAZQUEZ, S. L.",Ávila/AVILA,"CS, CP",,,
15.04126/P,"DISTRIBUCIONES QUESOS LATINOS, S.A.",Palencia/NESTAR,PP,,,
10.15362/SG,"GRUPO AMARO CORDEROS DE RIAZA, S. L.",Segovia/RIAZA,"CS, CP",,,
10.15371/SA,"SIERRA DE SANCHOTELLO, S. L.",Salamanca/SANCHOTELLO,PP,,MP,
