Nº RGSEAA (*),Razón Social,Provincia/Localidad,Actividades,Especies (**),Otros Detalles,TSE Feed Ban
10.00006/GE,CARNICAS VALL DE BAS SL,Girona/VALL D'EN BAS (LA),"CS, SH, CP",B,,
10.00023/L,MATADERO FIGUERA SA,Lleida/AGRAMUNT,"SH, CP",L,,
10.00056/GE,CONILLS DE L'EMPORDA SL,Girona/VILOPRIU,SH,L,,
10.00060/L,"MATILDE MASANA, SL",Lleida/SEU D'URGELL (LA),SH,L,,
10.00080/B,GENERAL MARKETS FOOD IBERICA SAU,Barcelona/MONTCADA I REIXAC,"CP, MM, MP",,,
10.00115/B,ROLER ESPAÑA SLU,Barcelona/TERRASSA,"RW, CP, MM, MP, PP",,MP,
10.00121/B,CASA TARRADELLAS SA,Barcelona/GURB,PP,,MP,
10.00126/GE,CARNICAS J. SITJA SA,Girona/OLOT,"CP, MSM",,,
10.00140/B,"PRODUCTOS SELECTOS DEL CERDO S.A. ""LA PIARA""",Barcelona/GRANOLLERS,SH,L,,
10.00144/L,MORROS FILLS SL,Lleida/ARTESA DE SEGRE,"SH, CP",L,,
10.00148/B,"MARGÓ CANUDAS, JOAN",Barcelona/PUIG-REIG,"MM, MP, PP",,MP,
10.00214/B,JOSEP DUCH SL,Barcelona/MEDIONA,"CS, CP, MM, MP, PP",,"MP, ST",
10.00222/B,CARNS I VIANDES DE CANOVELLES SL,Barcelona/CANOVELLES,"CP, MM, MP, PP",,MP,
10.00251/L,CARNICAS ORDOÑEZ SA,Lleida/VIELHA E MIJARAN,"MM, MP, PP",,MP,
10.00263/B,JAMONES SALA SL,Barcelona/SANT QUIRZE DEL VALLES,PP,,MP,
10.00272/L,SADA P.A. CATALUNYA SA,Lleida/LLEIDA,"CS, RW, SH, CP, MM, MP",A,,
10.00311/B,ESCORXADOR DE CONILLS MANUEL MARIN S.L.,Barcelona/FRANQUESES DEL VALLES (LES),"CS, SH, CP, MM, MP",L,,
10.00397/B,EMBOTITS CASSOLANS CA LA GLORIA SL,Barcelona/BALENYA,"MM, MP, PP",,MP,
10.00426/L,EMBUTIDOS BOTAN SL,Lleida/LLEIDA,"CP, MM, MP, PP",,MP,
10.00433/GE,ESPECIALITATS COSTA S.L.,Girona/BANYOLES,"CS, RW, CP, MM, MP, MSM",,MP,
10.00480/L,MAGASA MASO GASSO SA,Lleida/IVARS D'URGELL,"CS, RW, CP",,,
10.00502/B,ESCORXADOR D'AUS TORRENT I FILLS SA,Barcelona/MATARO,"SH, CP, MM, MP, PP",A,MP,
10.00520/T,CRIVELLE MONSERRAT SA,Tarragona/REUS,"CP, MM, MP",,,
10.00536/B,JAUME BARTOLI SL,Barcelona/SANTA PERPETUA DE MOGODA,"SH, CP, MM, MP",A,,
10.00541/B,INDUSTRIA AVICOLA DEL BERGUEDA SL,Barcelona/CASSERRES,"CS, SH, CP, MM, MP",A,,
10.00542/GE,CARNS LA CANYA SL,Girona/SANT JOAN LES FONTS,CP,,,
10.00633/T,PRODUCTES AVICOLES GRANJA GAIA SA,Tarragona/RIERA DE GAIA (LA),"CS, SH, CP, MM, MP, PP",A,MP,
10.00635/B,ESCORXADOR D'AVIRAM MORE SL,Barcelona/ARGENTONA,"CS, SH, CP, MM, MP, PP",A,MP,
10.00636/B,TOBELLA BOLTA SA,Barcelona/BADALONA,"CP, MM, MP, PP",,MP,
10.00641/B,"GIMENEZ AGUERA, JUAN",Barcelona/FRANQUESES DEL VALLES (LES),CS,,,
10.00648/B,JOSE ORS SA,Barcelona/CALDES DE MONTBUI,PP,,ST,
10.00655/B,LE PORC GOURMET SA,Barcelona/SANTA EUGENIA DE BERGA,"SH, CP, PP",P,ST,
10.00684/GE,CARNIQUES ILLAS JULI SL,Girona/BLANES,"RW, CP, MM, MP, PP",,MP,
10.00738/T,BORRULL BOTIGUES SL,Tarragona/REUS,"CS, RW, MM, MP, PP",,MP,
10.00743/B,MERCADOS DE ABASTECIMIENTOS DE BARCELONA SA,Barcelona/BARCELONA,SH,"B, C, O, S",,
10.00762/B,GIRBAU Y MARTI MATADERO DE AVES SA,Barcelona/RIPOLLET,"CS, SH, CP, MM, MP, PP",A,MP,
10.00778/B,ROCA-JUNQUE SL,Barcelona/GRANADA (LA),CP,,,
10.00781/B,AVESPUGA SA,Barcelona/HOSPITALET DE LLOBREGAT (L'),"CS, SH, CP",A,,
10.00784/B,"LLOBET MACIAN, RAFAEL",Barcelona/BARCELONA,CP,,,
10.00796/GE,CARNS BRUGUES SL,Girona/ARGELAGUER,"CS, CP",,,
10.00855/B,AVICOLA SANCHEZ SL,Barcelona/CORNELLA DE LLOBREGAT,"SH, CP, MM, MP, MSM",A,,
10.00879/B,CARNS ROMEU SL,Barcelona/GELIDA,"CP, MM, MP, PP",,MP,
10.00893/L,"BERCU, S.A.",Lleida/VALLFOGONA DE BALAGUER,"SH, CP",L,,
10.00924/B,JOSE SABATE SL,Barcelona/BARCELONA,"MM, MP, PP",,MP,
10.00929/B,TRIPERA VIGATANA SA,Barcelona/VIC,RW,,ST,
10.00944/B,CECARN SA,Barcelona/SANT PERE DE RIBES,"CP, MM, MP, PP",,MP,
10.00962/B,"CÀRNIQUES JAUME SORTS, SL",Barcelona/GURB,CP,,,
10.00974/B,TRIPAS ORS SL,Barcelona/ARENYS DE MUNT,PP,,ST,
10.01000/B,UNIO INTEGRAL ALIMENATARIA S.A.,Barcelona/FRANQUESES DEL VALLES (LES),"CP, MM, MP, PP",,MP,
10.01010/B,TERRASSA CARNES INDUSTRIALIZADAS SA,Barcelona/TERRASSA,"CS, RW, CP, MM, MP",,,
10.01036/B,OVINOS DEL TER SLU,Barcelona/GURB,CP,,,
10.01054/B,RIDOR SL,Barcelona/SANT FRUITOS DE BAGES,PP,,MP,
10.01057/T,PAVO Y DERIVADOS SA,Tarragona/AMPOSTA,"CS, SH, CP, MM, MP",A,,
10.01079/B,ALIMENTS I EMBOTITS SA,Barcelona/CALLDETENES,"MM, MP, PP",,MP,
10.01104/B,EMBUTIDOS ALVEN SL,Barcelona/SANT JOAN DE VILATORRADA,"MM, MP, PP",,MP,
10.01153/B,"FORCA ALVAREZ, DAVID",Barcelona/BADALONA,"MM, MP, PP",,MP,
10.01182/B,MATADERO FRIGORIFICO DEL CARDONER SA,Barcelona/SANT JOAN DE VILATORRADA,"CS, SH, CP, MM, MP, MSM, PP","P, B, C, O","MP, ST",
10.01184/B,MATADERO COMARCAL DEL BAGES SL,Barcelona/SANT JOAN DE VILATORRADA,"CS, SH, CP, PP",P,ST,
10.01185/GE,ARTIGAS ALIMENTARIA SAU,Girona/CORNELLA DEL TERRI,"SH, CP, MM, MP, PP","P, B, S","MP, ST",
10.01204/B,MATADERO FRIGORIFICO AVINYO SA,Barcelona/AVINYO,"CS, SH, CP, PP",P,,
10.01261/GE,FRIGORÍFICOS CÁRNICOS LAS FORCAS SL - (FRICAFOR),Girona/VILAFANT,"CS, SH, CP, PP",B,ST,
10.01263/GE,COOPECARN GIRONA SLU,Girona/CASSA DE LA SELVA,"MM, MP, PP",,MP,
10.01274/B,MAFRIGES SA,Barcelona/SANT VICENÇ DE TORELLO,"CS, SH, CP, PP",P,MP,
10.01290/B,ESCORXADOR ROJAS I ROCA SL,Barcelona/FRANQUESES DEL VALLES (LES),"SH, CP, MM, MP, PP","A, L",MP,
10.01293/B,PATEL S.A.U.,Barcelona/ESQUIROL (L´),"CS, SH, CP, PP",P,ST,
10.01317/GI,EMBOTITS MASOLIVER SL,Girona/VALL D'EN BAS (LA),"CS, RW, PP",,,
10.01318/GE,CASADEMONT 1956 MEAT SL,Girona/PALOL DE REVARDIT,PP,,MP,
10.01321/GE,JAUME ABRAS SA,Girona/RIUDELLOTS DE LA SELVA,"RW, MM, MP, PP",,MP,
10.01328/B,FABRICA DE EMBUTIDOS V. SERRET M. SL,Barcelona/PAPIOL (EL),"CP, MM, MP, PP",,MP,
10.01349/B,EMBUTIDOS ARTESANOS CASA PAREDES S.L.,Barcelona/SANTA COLOMA DE GRAMENET,"MM, MP, PP",,MP,
10.01402/GE,EMBOTITS FALGAS SL,Girona/SANT MIQUEL DE FLUVIA,PP,,MP,
10.01413/B,ANETO NATURAL SL,Barcelona/ARTES,PP,,MP,
10.01444/T,"BUNDO MARQUES, MANUEL",Tarragona/ARBOÇ (L'),"CS, CP, MM, MP, PP",,MP,
10.01453/GE,EMBOTITS BOADA PORCEL SL,Girona/VILOBI D'ONYAR,"CP, MM, MP, PP",,MP,
10.01506/T,PAVO Y DERIVADOS SA,Tarragona/ROQUETES,"CS, SH, CP, MM, MP, MSM",A,,
10.01597/L,"VILA MATA, ANTONI",Lleida/CERVERA,"MM, MP, PP",,MP,
10.01620/B,DESPIECE DEL CERDO SL,Barcelona/MANLLEU,PP,,MP,
10.01631/B,AVINFRET SA,Barcelona/AVINYO,"CP, MM, MP, PP",,MP,
10.01648/B,"BELMONTE RECHE, PEDRO ANGEL",Barcelona/BARCELONA,"MM, MP, PP",,MP,
10.01649/B,CATALANA DE EMBUTIDOS SA,Barcelona/BALSARENY,"CS, RW, MM, MP, PP",,MP,
10.01655/GE,RAMON VENTULA SA,Girona/OLOT,"CS, PP",,MP,
10.01656/B,EMBOTITS CASSANY SA,Barcelona/TARADELL,"MM, MP, PP",,MP,
10.01657/L,EMBUTIDOS BI HER SA,Lleida/BALAGUER,"MM, MP, PP",,MP,
10.01658/GE,FRANCISCO PUIGVERT SL,Girona/OLOT,PP,,MP,
10.01699/GE,ESTEBAN ESPUÑA SA,Girona/OLOT,"CS, PP",,MP,
10.01738/B,"MACIA XIBERTA, RITA",Barcelona/BARCELONA,"CP, PP",,MP,
10.01764/B,L'OBRADOR DE M. GRIFUL SL,Barcelona/SANT CUGAT DEL VALLES,"MM, MP, PP",,MP,
10.01769/GE,FONT SANS SA,Girona/SANT FELIU DE PALLEROLS,PP,,MP,
10.01781/GE,RAFAEL BARO SA,Girona/CERVIA DE TER,PP,,MP,
10.01782/GE,LUIS OLIVERAS SA,Girona/OLOT,"RW, PP",,MP,
10.01807/B,LA PIARA SAU,Barcelona/MANLLEU,PP,,MP,
10.01810/GE,HIJOS DE JOSE CASAPONSA SA,Girona/VALL DE BIANYA (LA),PP,,MP,
10.01830/GE,FRIGORIFICOS COSTA BRAVA SA,Girona/QUART,"RW, CP",,MP,
10.01862/GE,JOAQUIM ALBERTI SA,Girona/CAMPLLONG,"MM, MP, PP",,MP,
10.01863/GE,EMBUTIDOS CASEROS COLLELL SLU,Girona/PRESES (LES),PP,,MP,
10.01864/GE,BOADAS 1880 SA,Girona/GIRONA,PP,,MP,
10.01865/GE,EMBUTIDOS CAULA SL,Girona/SANT GREGORI,PP,,MP,
10.01867/GE,JUAN AULET TORRENT SL,Girona/ANGLES,PP,,MP,
10.01878/B,EMBUTIDOS SALGOT SA,Barcelona/AIGUAFREDA,"MM, MP, PP",,MP,
10.01886/B,INTERNACIONAL DE EMBUTIDOS SAU,Barcelona/MONTCADA I REIXAC,"RW, MM, MP, PP",,MP,
10.01887/GE,EMBOTITS CROS SA,Girona/CAMPRODON,"MM, MP, PP",,MP,
10.01888/GE,FAR JAMON SERRANO SA,Girona/PRESES (LES),PP,,MP,
10.01889/GE,CASANOVA HERMANOS SA,Girona/CAMPRODON,"RW, PP",,MP,
10.01897/GE,EMBOTITS LAPEDRA SL,Girona/SANT PAU DE SEGURIES,"MM, MP, PP",,MP,
10.01898/GE,J CUROS SL,Girona/PRESES (LES),PP,,MP,
10.01900/B,SUCESORES DE J. PONT SA,Barcelona/BALENYA,PP,,MP,
10.01907/GE,"ASPAR RICART, FRANCISCO",Girona/MOLLO,"MM, MP, PP",,MP,
10.01908/B,LASUS MARSA SA,Barcelona/MONTCADA I REIXAC,"MM, MP, PP",,MP,
10.01917/B,CASA RIERA ORDEIX SA,Barcelona/VIC,PP,,MP,
10.01924/B,EMBUTIDOS SOLA SA,Barcelona/GURB,"MM, MP, PP",,MP,
10.01925/GE,CAPDEVILA GERMANS SA,Girona/SILS,PP,,MP,
10.01928/B,CONSERVAS AUSA SA,Barcelona/PRATS DE LLUÇANES,PP,,MP,
10.01929/B,ARAGONES NOGUERA SLU,Barcelona/IGUALADA,"MM, MP, PP",,MP,
10.01931/GE,HERMANOS FONT VERDAGUER SA,Girona/VALL D'EN BAS (LA),PP,,MP,
10.01932/B,EMBUTIDOS MONELLS SA,Barcelona/MASIES DE VOLTREGA (LES),"MM, MP, PP",,MP,
10.01934/GE,NOEL ALIMENTARIA SAU,Girona/SANT JOAN LES FONTS,"CS, RW, PP",,MP,
10.01935/GE,CARNS I EMBOTITS GARROTXA SA,Girona/VALL D'EN BAS (LA),"CP, MM, MP, PP",,MP,
10.01936/B,EXTRAPERNIL DEL MONTSENY SL,Barcelona/SEVA,PP,,MP,
10.01943/GE,FRIBEL SA,Girona/VERGES,"CS, SH, CP, MM, MP, PP","B, C, O",MP,
10.01944/GE,EMBUTIDOS CASEROS COLLELL SLU,Girona/OLOT,"RW, PP",,MP,
10.01945/GE,ESTEBAN ESPUÑA SA,Girona/OLOT,"CS, PP",,MP,
10.01956/B,CLOSA I FILLS SL,Barcelona/COPONS,"SH, CP","A, L",,
10.01958/B,SUAC SA,Barcelona/PUIG-REIG,"CS, PP",,MP,
10.01961/T,FOMAT SA,Tarragona/SARRAL,PP,,MP,
10.01962/GE,CASADEMONT 1956 MEAT SL,Girona/SANT GREGORI,"RW, MM, MP, PP",,MP,
10.01965/T,EMBOTITS VIBER SL,Tarragona/VALLS,"MM, MP, PP",,MP,
10.01970/B,INDUSTRIAS CARNICAS BLANCAFORT SA,Barcelona/GRANOLLERS,"RW, PP",,MP,
10.01975/GE,JUNCA GELATINES SLU,Girona/BANYOLES,PP,,PAP,
10.01976/B,LA MILANESA SLU,Barcelona/FRANQUESES DEL VALLES (LES),PP,,MP,
10.03893/T,J. MILA SA,Tarragona/SANTA OLIVA,"CP, MM, MP",,,
10.03895/T,EMBOTITS FIGUEROLA SL,Tarragona/VALLMOLL,CS,,,
10.03896/GE,ECORIERA SLU,Girona/VALL D'EN BAS (LA),"CS, CP, MM, MP, PP",,MP,
10.03897/GE,FREYCO SL,Girona/SANT JOAN LES FONTS,"RW, CP",,MP,
10.03903/L,LERIDANA DE PIENSOS SA,Lleida/VALLFOGONA DE BALAGUER,"CS, SH, CP",P,,
10.03918/B,DISTRIBUCIONES JOSEP LLEONART SLL,Barcelona/TERRASSA,"CS, CP, MM, MP",,,
10.03920/B,ANCAU SA,Barcelona/SANTA COLOMA DE CERVELLO,"CP, MM, MP, PP",,MP,
10.03924/B,CARNICAS SOLA SA,Barcelona/GURB,"CS, CP, MSM",,,
10.03929/GE,FRIGORIFICOS COSTA BRAVA SA,Girona/VILAMALLA,"CS, CP",,,
10.03931/GE,MARIA DEL TURA FEIXAS SA,Girona/PRESES (LES),"CS, RW, CP",,,
10.03935/GE,FRIGORIFICOS COSTA BRAVA SA,Girona/RIUDELLOTS DE LA SELVA,"CS, SH, CP, MM, MP, PP",P,ST,
10.03936/GE,UNION FOODS SL,Girona/OLOT,CP,,,
10.03941/L,OBACH SL,Lleida/ORGANYA,"MM, MP, PP",,MP,
10.03942/L,SERVEIS ESCORXADORS DEL SEGRIÀ SA,Lleida/LLEIDA,"CS, RW, SH, CP, MM, MP",A,,
10.03943/L,CARNICAS ARMENGOL SL,Lleida/TARREGA,"CS, RW, CP",,,
10.03947/L,"PRODUCTOS GEMI 1966, SL",Lleida/BELLPUIG,"MM, MP, PP",,MP,
10.03948/L,CORPORACION ALIMENTARIA GUISSONA SA,Lleida/GUISSONA,"CS, RW, SH, CP, MM, MP, MSM, PP","P, A, B, C, O",MP,
10.03949/L,MASIA TERO SA,Lleida/TORREGROSSA,"SH, CP",P,,
10.03950/L,FORTUNE PIG SL,Lleida/MOLLERUSSA,"CS, SH, CP, PP",P,ST,
10.03952/T,BON DRIA SL,Tarragona/ALFORJA,"CS, CP, MM, MP, PP",,MP,
10.03954/GE,FONT CANA SA,Girona/SANT JOAN LES FONTS,PP,,MP,
10.03956/L,RABBIT KING SL,Lleida/PREIXENS,SH,L,,
10.03957/L,CASA BERNADI SL,Lleida/VALLS D'AGUILAR (LES),"SH, CP, MM, MP, PP",P,MP,
10.03958/L,"FARRE FARRANDO, JOSE Y OTROS CB",Lleida/TREMP,"SH, CP",L,,
10.03959/GE,EMBOTITS CASOLANS DE L'EMPORDA SL,Girona/VILAFANT,PP,,MP,
10.03960/GE,EMBUTIDOS SARQUELLA SL,Girona/BANYOLES,PP,,MP,
10.03970/B,EMBUTIDOS MONELLS SA,Barcelona/SEVA,PP,,MP,
10.03971/B,SL DROMINIA,Barcelona/BARCELONA,"RW, CP, MM, MP",,,
10.03979/B,EMBOTITS ESPINA SAU,Barcelona/VIC,PP,,MP,
10.03987/GE,FRIGORIFICOS UNIDOS SA,Girona/RIUDELLOTS DE LA SELVA,"CS, SH, CP, PP","B, C, O",MP,
10.03992/T,VENANCI MONCADA SL,Tarragona/SALOMO,"CS, SH, CP, MM, MP",L,,
10.03995/GE,"SOLA FREIXA, CONCEPCIO",Girona/MOLLO,"MM, MP, PP",,MP,
10.04005/GE,FLORENCIO FONT CANAL SA,Girona/RIPOLL,PP,,MP,
10.04006/GE,JUAN PUIGVERT SL,Girona/SANT FELIU DE PALLEROLS,PP,,MP,
10.04008/GE,"QUOSETIA, SLU",Girona/SANT JOAN DE LES ABADESSES,PP,,MP,
10.04016/B,ESPUGA INDUSTRIAL Y COMERCIAL AVICOLA Y SUS DERIVADOS SA,Barcelona/HOSPITALET DE LLOBREGAT (L'),"MM, MP, PP",,MP,
10.04017/L,URGEL GANADERA SA,Lleida/JUNEDA,"CS, RW, SH",A,,
10.04044/GE,FIBRAN SA,Girona/SANT JOAN DE LES ABADESSES,PP,,,
10.04045/B,EMBOTITS ARUMI CASTELLS SL,Barcelona/BALENYA,"CP, PP",,MP,
10.04050/B,F. JODAS SA,Barcelona/CERDANYOLA DEL VALLES,"CP, MM, MP",,,
10.04056/B,MAS AVICOLA SA,Barcelona/SABADELL,"CS, RW, SH, CP, MM, MP, PP",A,MP,
10.04057/B,GEDESCO SA,Barcelona/MONTCADA I REIXAC,"MM, MP, PP",,MP,
10.04059/GE,NOEL ALIMENTARIA SAU,Girona/OLOT,"CS, RW, CP, MM, MP, PP",,MP,
10.04060/L,SAGRA SA,Lleida/FONDARELLA,"CS, SH, CP, MM, MP, MSM",A,,
10.04063/B,ALIMENTBARNA SL,Barcelona/MONTCADA I REIXAC,"CS, CP, MM, MP",,,
10.04071/B,MORTE SA,Barcelona/SABADELL,"CS, RW, PP",,MP,
10.04074/T,PO DE GARI SA,Tarragona/VALLS,"CS, MM, MP, PP",,"BL, MP, ST",
10.04077/L,MATADERO DE AVES GUIU SL,Lleida/SEU D'URGELL (LA),"CS, SH, CP, MM, MP",A,,
10.04082/T,INDUSTRIA ALIMENTARIA CRUSVI SL,Tarragona/RIUDOMS,"CS, SH, CP, MM, MP, MSM",A,,
10.04086/B,EMBOTITS PEDRAGOSA SA,Barcelona/CALDES DE MONTBUI,"CS, MM, MP, PP",,MP,
10.04087/B,"NAVARRO CAMPUZANO, ANTONIO",Barcelona/CASTELLAR DEL VALLES,PP,,MP,
10.04088/GE,RAMON VENTULA SA,Girona/VALL DE BIANYA (LA),PP,,MP,
10.04098/B,LLONGANISSA TORI SLU,Barcelona/AVINYO,"MM, MP, PP",,MP,
10.04100/GE,FRIGORIFICOS DE OLOT S.A.,Girona/OLOT,CS,,,
10.04103/GE,LINEA ALIMENTARIA SL,Girona/SERINYA,"RW, SH, CP, MM, MP",L,,
10.04108/B,CARNS PRIOR SL,Barcelona/SANT JOAN DESPI,CP,,,
10.04121/B,CARNS I EMBOTITS TORRA SL,Barcelona/TORDERA,"CP, MM, MP, PP",,MP,
10.04122/GE,AVICOLA FIGUERES SL,Girona/FIGUERES,"SH, CP, MM, MP",A,,
10.04125/B,ANTARES GERUNDA SL,Barcelona/ESQUIROL (L´),"MM, MP, PP",,MP,
10.04129/L,MATADERO GENERAL FRIGORIFICO DE LA SEU D'URGELL SA,Lleida/SEU D'URGELL (LA),"SH, CP, MM, MP, PP","B, C, O, S",MP,
10.04130/GE,"LLEMANA CURATS, SL",Girona/SANT ANIOL DE FINESTRES,PP,,MP,
10.04134/B,CARNS FONT S.A.,Barcelona/PAPIOL (EL),CS,,,
10.04161/B,JAMONES CENTELLES SLU,Barcelona/BALENYA,PP,,MP,
10.04165/GE,ELABORATS ARTESANS GUELL SL,Girona/RIUDARENES,"MM, MP, PP",,MP,
10.04171/GE,SANT DALMAI SAU,Girona/VILOBI D'ONYAR,"MM, MP, PP",,MP,
10.04172/GE,INMOSALVA SL,Girona/JUIA,RW,,MP,
10.04173/L,AEROPIC SA,Lleida/LLEIDA,"CS, RW, SH",A,,
10.04176/GE,VILNAT SL,Girona/SANT JAUME DE LLIERCA,PP,,ST,
10.04185/GE,PORTAS SA,Girona/SERINYA,"CS, CP, MM, MP, PP",,MP,
10.04190/T,"FERRE FERRE, JOAN MARIA",Tarragona/PLA DE SANTA MARIA (EL),CS,,,
10.04194/GE,EMBUTIDOS MONTER SLU,Girona/PLANES D'HOSTOLES (LES),"MM, MP, PP",,MP,
10.04199/GE,ARTESANIES CARLIT SA,Girona/PUIGCERDA,PP,,MP,
10.04204/GE,MIQUEL DORCA SL,Girona/VALL DE BIANYA (LA),"SH, CP, MM, MP, PP",P,MP,
10.04206/B,CARNS PONT SA,Barcelona/BARCELONA,"CP, MM, MP",,,
10.04212/B,CARNS RIU SL,Barcelona/CALDES DE MONTBUI,"CP, MM, MP",,,
10.04231/GE,FUSTE BURGAS SA,Girona/FIGUERES,"CP, MM, MP, PP",,MP,
10.04233/GE,"CORONADO LOPEZ, MARIANO",Girona/QUART,"CS, SH",L,,
10.04235/B,MARGARITA MARCH BOSCH SA,Barcelona/PALAU-SOLITA I PLEGAMANS,PP,,MP,
10.04241/B,"SUMINISTROS MEGARO FOODS, SL",Barcelona/MARTORELL,"CS, RW, CP, MM, MP",,MP,
10.04244/B,FRIGORIFICOS BETULO SA,Barcelona/BADALONA,"CP, MM, MP, PP",,MP,
10.04247/GE,PRODUCTORA DESFER CAPS SLU,Girona/ARGELAGUER,"CS, CP",,,
10.04248/L,RENE FLOR SA,Lleida/LLEIDA,"CS, PP",,ST,
10.04253/GE,EMBUTIDOS MONTER SLU,Girona/SANT JAUME DE LLIERCA,PP,,MP,
10.04258/GE,EMBOTITS EUGENI SC,Girona/SANT JOAN LES FONTS,PP,,MP,
10.04265/B,EMBOTITS LA GLEVA SL,Barcelona/MASIES DE VOLTREGA (LES),"CS, MM, MP, PP",,MP,
10.04273/L,J. BOSCH SLU,Lleida/LLEIDA,RW,,ST,
10.04277/GE,EMBOTITS D'OIX SL,Girona/MONTAGUT I OIX,PP,,MP,
10.04285/B,VIÑALS SOLER SL,Barcelona/ARGENTONA,"CS, SH, CP, PP","B, S",ST,
10.04298/B,CARNS GERARDO LOPEZ S.L.,Barcelona/CORNELLA DE LLOBREGAT,"CS, CP, PP",,MP,
10.04311/GE,"CARNICA BATALLE, SA",Girona/RIUDARENES,"CS, CP, MM, MP, MSM, PP",,,
10.04315/L,"AVICSA, SABORS SELECTES, SL",Lleida/LLEIDA,PP,,MP,
10.04327/B,GERMANS AYMERICH ISERN SL,Barcelona/SANT JULIA DE VILATORTA,"CS, RW, PP",,"MP, ST",
10.04332/L,TOCINERIA CASASNOVAS SL,Lleida/VIELHA E MIJARAN,PP,,MP,
10.04334/GE,AVICOLA MARIA SA,Girona/BEGUR,"CS, SH, CP, MM, MP",A,,
10.04340/B,CASA BOIX SL,Barcelona/SANT PERE DE RIUDEBITLLES,PP,,MP,
10.04343/B,EMBUTIDOS LLOBET SA,Barcelona/MATARO,"MM, MP, PP",,MP,
10.04347/GE,PROTEIN SA,Girona/CELRA,PP,,,
10.04354/B,COSTA ANGELET SA,Barcelona/VILANOVA DEL VALLES,"CP, MM, MP, PP",,MP,
10.04361/B,ARUMI II 2016 SL,Barcelona/TARADELL,PP,,MP,
10.04364/GE,TRIPERIA LA SELVA SL,Girona/RIUDELLOTS DE LA SELVA,PP,,ST,
10.04365/GE,EMBOTITS VILANOVA SL,Girona/TORTELLA,"CS, SH, CP, MM, MP, PP","B, C, O",MP,
10.04366/B,CARNICAS GINES SL,Barcelona/TERRASSA,"CP, MM, MP, PP",,MP,
10.04367/L,AJUNTAMENT DE CORBINS,Lleida/CORBINS,SH,P,,
10.04368/GE,JOSE XARGAYO SA,Girona/AIGUAVIVA,RW,,MP,
10.04369/T,CARNS TORRAS SA,Tarragona/ARBOÇ (L'),"CS, CP, MM, MP, PP",,MP,
10.04370/B,EMBUTIDOS SALGOT SA,Barcelona/SEVA,"CP, MM, MP, PP",,MP,
10.04376/B,FUNDACIO PRIVADA MAS ALBORNA,Barcelona/LLACUNA (LA),"MM, MP, PP",,MP,
10.04377/B,PAGES DE ROFES S.L.,Barcelona/LLACUNA (LA),"CS, SH, CP, MM, MP","A, L",,
10.04389/L,EMBOTITS CASOLANS VALL CARDÓS SL,Lleida/VALL DE CARDOS,"CS, MM, MP, PP",,MP,
10.04392/T,"BENITO LLENAS, ANTONIO",Tarragona/AIGUAMURCIA,"MM, MP, PP",,MP,
10.04396/GE,ROCA 1927 SLU,Girona/BANYOLES,"CS, SH, CP","B, C, O",,
10.04397/GE,GINJAUME SL,Girona/AVINYONET DE PUIGVENTOS,PP,,MP,
10.04400/B,EMBOTITS MAS SA,Barcelona/BALSARENY,"CS, CP, MM, MP, PP",,MP,
10.04407/GE,CONSERVAS DE CARNE CRUSET SA,Girona/FIGUERES,PP,,MP,
10.04409/GE,CARNS I EMBOTITS N. VICENS SL,Girona/AIGUAVIVA,"CP, MM, MP, PP",,MP,
10.04414/GE,RAMON VENTULA SA,Girona/VALL DE BIANYA (LA),PP,,MP,
10.04415/GE,LLOVERAS XARCUTERS SC,Girona/CASSA DE LA SELVA,PP,,MP,
10.04421/B,GREMIAL DE CATALUNYA SL,Barcelona/CASTELLBISBAL,"CS, SH, CP, PP","B, C, O, S","MP, ST",
10.04422/B,RAMTAUB S.A.,Barcelona/RIPOLLET,"CS, RW, PP",,ST,
10.04423/GE,EMBOTITS ARTESANS J. VILA SL,Girona/BORRASSA,PP,,MP,
10.04425/GE,FRISELVA SA,Girona/RIUDELLOTS DE LA SELVA,"CS, SH, CP, MSM, PP",P,ST,
10.04427/GE,COLLS CARRERAS SL,Girona/VIDRERES,"CP, MM, MP, PP",,MP,
10.04429/B,EMBOTITS ARTESANALS CAMPRUBI SL,Barcelona/ALPENS,"MM, MP, PP",,MP,
10.04431/B,EMBOTITS VILARDAGA SL,Barcelona/ALPENS,"MM, MP, PP",,MP,
10.04441/GE,INNODUCKY SL,Girona/BRUNYOLA,PP,,MP,
10.04443/T,CONILLS PAGES SL,Tarragona/REUS,SH,L,,
10.04444/T,BALDO PALLARES SA,Tarragona/PERELLO (EL),"CS, RW, SH, CP, MM, MP",L,,
10.04450/B,AVIBAGES SL,Barcelona/SANT JOAN DE VILATORRADA,"CS, SH, CP, MM, MP, PP","A, L",MP,
10.04459/B,"FARRERONS COSTA, LLUÍS",Barcelona/MANLLEU,"CP, MM, MP",,,
10.04469/B,CARNS GUAL SL,Barcelona/IGUALADA,"CS, RW, CP, MM, MP",,,
10.04472/B,GRUP BAUCELLS ALIMENTACIÓ SL,Barcelona/VIC,"CP, MM, MP",,,
10.04656/B,APC EUROPE SLU,Barcelona/GRANOLLERS,"RW, PP",,"PAP, BL, MP",
10.04742/B,CARNICAS POCRE S.L.,Barcelona/SENTMENAT,"CS, PP",,MP,
10.04748/GE,"LOPEZ CODINA, GREGORIO",Girona/VALL D'EN BAS (LA),PP,,MP,
10.04854/T,CARNICAS FILLAT SL,Tarragona/VILA-SECA,"CS, CP, MM, MP, PP",,MP,
10.04857/B,CANSALADERIA SERRAT SA,Barcelona/VIC,"CP, MM, MP, PP",,MP,
10.04942/B,EMBOTITS SANCHEZ SL,Barcelona/TERRASSA,"MM, MP, PP",,MP,
10.04944/GE,ESCORXADOR VILA DE L'ARMENTERA S.L,Girona/ARMENTERA (L'),SH,"P, B, C, O",,
10.04945/T,PRODUCTOS PUIG SL,Tarragona/TORTOSA,"CS, CP, MM, MP, PP",,MP,
10.04997/GE,COSTABELLA SA,Girona/CASTELLFOLLIT DE LA ROCA,PP,,MP,
10.05024/L,AJUNTAMENT D'ISONA I CONCA DELLA,Lleida/ISONA I CONCA DELLA,SH,"P, C, O",,
10.05052/GE,BENKELTRIP SLU,Girona/SANT JOAN LES FONTS,PP,,ST,
10.05053/B,COMPANYIA GENERAL CARNIA SA,Barcelona/BARCELONA,"CP, MM, MP, PP",,MP,
10.05054/GE,COMERCIAL SUBPRODUCTOS SA,Girona/CELLERA DE TER (LA),"RW, PP",,ST,
10.05059/L,AJUNTAMENT D'ALFARRAS,Lleida/ALFARRAS,SH,"P, C, O",,
10.05060/GE,EMBOTITS MIRO SL,Girona/CAMPDEVANOL,"MM, MP, PP",,MP,
10.05063/B,FRIMOSA SA,Barcelona/SANT QUIRZE DEL VALLES,"CS, RW, CP, PP",,"MP, ST",
10.05102/GE,AJUNTAMENT DE PERALADA,Girona/PERALADA,SH,"C, O",,
10.05128/B,FRANCISCO MARTINEZ GRACIA CB,Barcelona/TERRASSA,PP,,ST,
10.05177/B,AGROALIMENTARIA DE SAVASSONA SL,Barcelona/TAVERNOLES,"CP, MM, MP, PP",,MP,
10.05204/B,ESCORXADOR COMARCAL DEL MOIANES SA,Barcelona/MOIA,"CS, SH, CP, PP",P,ST,
10.05205/B,CARNS CAN CARTRO SL,Barcelona/SUBIRATS,SH,"C, O",,
10.05213/GE,FRECARN SL,Girona/MAÇANET DE LA SELVA,"CS, CP, MM, MP, PP",,MP,
10.05244/L,ESCORXADOR L'ALT URGELL SCP,Lleida/OLIANA,SH,"C, O",,
10.05246/B,"CASTELLVI SENTIS, JOAN",Barcelona/CORBERA DE LLOBREGAT,"MM, MP, PP",,MP,
10.05276/GE,FRIGORIFICOS DALMAU SA,Girona/CELRA,CP,,,
10.05287/B,SOLER URGELL SL,Barcelona/CALDERS,"SH, CP",L,,
10.05357/GE,OLOT MEATS SA,Girona/OLOT,"SH, CP, PP",P,ST,
10.05358/L,AJUNTAMENT DE TORREBESSES,Lleida/TORREBESSES,SH,O,,
10.05426/GE,EMBOTITS PAGES SL,Girona/CANET D'ADRI,"MM, MP, PP",,MP,
10.05427/B,SPLENDID FOODS SAU,Barcelona/SEVA,"CP, MM, MP, PP",,MP,
10.05473/L,CONSELL COMARCAL DE L'ALTA RIBAGORÇA,Lleida/PONT DE SUERT (EL),SH,"P, B, C, O",,
10.05475/GE,ESCORXADOR DE GIRONA SA,Girona/GIRONA,"CS, SH, CP","B, C, O, S",,
10.05519/B,MATADERO DE AVES ALMIRALL SL,Barcelona/CERDANYOLA DEL VALLES,CS,,,
10.05523/L,CONILLS CAUBET SRL,Lleida/ARTESA DE SEGRE,"SH, CP, MM, MP",L,,
10.05524/L,CARNIQUES DEL PLA SL,Lleida/MOLLERUSSA,"CS, CP, MM, MP",,,
10.05570/GE,CUSINS SL,Girona/FIGUERES,"CP, MM, MP",,,
10.05573/B,CARNES CAMPMANY S.A.,Barcelona/BADALONA,"CS, CP",,,
10.05575/L,ARGAL ALIMENTACIÓN SA,Lleida/MIRALCAMP,"RW, PP",,MP,
10.05652/B,"CODINA CODINA, JORDI",Barcelona/PUIG-REIG,CS,,,
10.05655/GE,PRODUCTOS VALENT SA,Girona/GIRONA,"MM, MP, PP",,MP,
10.05724/GE,EMBOTITS CATALANS SL,Girona/SANT JORDI DESVALLS,PP,,MP,
10.05725/GE,EMBUTIDOS CASEROS COLLELL SLU,Girona/PRESES (LES),PP,,MP,
10.05726/B,AJUNTAMENT DE SANTA MARGARIDA DE MONTBUI,Barcelona/SANTA MARGARIDA DE MONTBUI,SH,"C, O",,
10.05763/GE,ROUSSELOT GELATIN SL,Girona/CERVIA DE TER,PP,,,
10.05881/GE,EMBUTIDOS MONTSA SA,Girona/OLOT,PP,,MP,
10.05905/T,"BENAIGES PASCUAL, RAMON",Tarragona/FATARELLA (LA),"MM, MP, PP",,MP,
10.05907/GE,ESCORXADOR FRIGORIFIC REIXACH SL,Girona/HOSTALRIC,"SH, CP",P,,
10.05928/GE,EMPORTRIP SA,Girona/PERA (LA),PP,,ST,
10.06067/GE,J. ROURA BAGUE SL,Girona/CORÇA,"CP, MM, MP, PP",,MP,
10.06078/B,JOSEP MARIA MITJANS SL,Barcelona/OLERDOLA,"MM, MP, PP",,MP,
10.06083/B,AJUNTAMENT DE SANT MARTI SESGUEIOLES,Barcelona/SANT MARTI SESGUEIOLES,SH,"C, O",,
10.06123/T,AJUNTAMENT DE FALSET,Tarragona/FALSET,SH,"C, O",,
10.06124/T,AJUNTAMENT DE LA GALERA,Tarragona/GALERA (LA),SH,"C, O",,
10.06144/B,TOCINERIAS VENTURA SA,Barcelona/TERRASSA,"RW, MM, MP, PP",,MP,
10.06145/B,PERDIUS SELECTES GIRALT SL,Barcelona/TORDERA,"CS, SH",A,,
10.06265/GE,ANEC DE L'EMPORDA SL,Girona/SERRA DE DARO,"RW, PP",,MP,
10.06270/B,ENRIC ROCA SA,Barcelona/SURIA,"CS, CP, MM, MP, MSM, PP",,MP,
10.06274/L,INDELESA SL,Lleida/ALCOLETGE,"CS, SH, CP, PP","B, C, O",MP,
10.06327/T,FORES & CID CANSALADERS SL,Tarragona/TORTOSA,"CP, MM, MP, PP",,MP,
10.06328/GE,CHARCUTERIA Y COCINADOS SA,Girona/CASSA DE LA SELVA,PP,,MP,
10.06330/B,EMBOTITS MEDRAN SL,Barcelona/SABADELL,"MM, MP, PP",,MP,
10.06360/B,CANSALADERIA SINGLA SL,Barcelona/NAVARCLES,"CP, MM, MP, PP",,MP,
10.06446/B,"LARA RODRIGUEZ, FRANCISCO",Barcelona/CASTELLDEFELS,"MM, MP, PP",,MP,
10.06466/B,ESCORXADOR SABADELL SA,Barcelona/SABADELL,"SH, CP, PP","B, C, O, S",MP,
10.06522/B,EMBOTITS CASA CRUELLS SL,Barcelona/ALPENS,"MM, MP, PP",,MP,
10.06544/T,CAN PISTRAQUES SL,Tarragona/RIERA DE GAIA (LA),"MM, MP, PP",,MP,
10.06579/GE,CARNIQUES DE JUIÀ SA,Girona/JUIA,"CS, CP, MSM, PP",,MP,
10.06638/L,AJUNTAMENT DE TORÀ,Lleida/TORA,SH,"C, O",,
10.06642/B,PRECOCINADOS ORTEGA SL,Barcelona/IGUALADA,"MM, MP",,,
10.06643/T,LUIS COLET SA,Tarragona/TARRAGONA,"CP, MM, MP, PP",,MP,
10.06661/B,"CONEJO NAVAS, MANEL",Barcelona/MASNOU (EL),"MM, MP, PP",,MP,
10.06666/L,PRODUCTES CARNIS JOAN ARQUES SA,Lleida/JUNEDA,"CS, RW, CP, MM, MP",,,
10.06725/B,JAVOSA SA,Barcelona/MASIES DE VOLTREGA (LES),PP,,MP,
10.06726/B,EMBOTITS CAN ROSES S.L.,Barcelona/RUBI,"CS, MM, MP, PP",,MP,
10.06727/B,CANSALADERIES GRAU SL,Barcelona/BARCELONA,"MM, MP, PP",,MP,
10.06728/B,CARNS ARTIGAS S.A.,Barcelona/HOSPITALET DE LLOBREGAT (L'),"CS, CP",,,
10.06744/B,CARNIQUES AUSA SL,Barcelona/MONTESQUIU,"CS, CP, MSM",,,
10.06814/B,FELIX CONSUL GRAU SL,Barcelona/TERRASSA,"RW, MM, MP, PP",,MP,
10.06817/B,PRECUITS SL,Barcelona/SANT FRUITOS DE BAGES,"MM, MP, PP",,MP,
10.06901/B,"FERNANDEZ COLL, JOAN BAPTISTA",Barcelona/VIC,"MM, MP, PP",,MP,
10.06903/B,MARIO ELABORATS I CARNS SLU,Barcelona/GAVA,"MM, MP, PP",,MP,
10.06904/B,CRISTOFRAN SL,Barcelona/SANT CUGAT DEL VALLES,"MM, MP, PP",,MP,
10.06907/B,ESCORXADOR IND. DE CONILLS J. GRAU SL,Barcelona/CALAF,"SH, CP",L,,
10.06909/B,PINCHOS SANCHO SL,Barcelona/HOSPITALET DE LLOBREGAT (L'),"MM, MP",,,
10.06923/GE,"VALLS MUNTADA, JORDI",Girona/BRUNYOLA,"SH, MM, MP, PP","P, B, C, O",MP,
10.06941/L,CONSELH GENERAU D'ARAN,Lleida/LES,SH,"B, C, O, S",,
10.06943/L,EMBUTIDOS SETÓ MARTÍ SL,Lleida/TARREGA,"CS, MM, MP",,,
10.06945/L,AJUNTAMENT DE LA GRANADELLA,Lleida/GRANADELLA (LA),SH,"C, O",,
10.06957/L,XOLIS DEL PALLARS SCCL,Lleida/ISONA I CONCA DELLA,"CP, MM, MP, PP",,MP,
10.06959/B,PRODUCTOS CARNICOS GRAU SL,Barcelona/BARBERA DEL VALLES,"CP, MM, MP, PP",,MP,
10.06966/L,ESCORXADOR DE PONENT SL,Lleida/BALAGUER,"SH, CP","P, B, C, O, S",,
10.06968/GE,ROURA COLL SALA DE DESPIECE SL,Girona/GIRONA,"RW, CP, PP",,MP,
10.06980/B,"NOVOA ALVAREZ, JONATHAN",Barcelona/BARCELONA,PP,,MP,
10.07001/B,"DOMENECH TRAVE, JOSEP",Barcelona/LLACUNA (LA),"CP, MM, MP, PP",,MP,
10.07032/B,ELS TRES SL,Barcelona/BARCELONA,"CS, MM, MP",,,
10.07036/B,EMBOTITS CLOSA SL,Barcelona/CALAF,"RW, MM, MP, PP",,MP,
